number,value,datetime_start,datetime_complete,duration,params_BEAR_GRID_MAX_LAYER_CAP,params_BEAR_GRID_MODE,params_BEAR_RATIO,params_BEAR_UNIVERSE_MODE,params_BULL_RATIO,params_GRID_MAX_LAYER,params_GRID_STEP_MAX,params_GRID_STEP_MIN,params_GRID_STEP_VOL_FACTOR,params_LAYER_FRACTION,params_MAX_HOLD,params_NEUTRAL_RATIO,params_REBALANCE_FREQ,params_VOL_WEIGHT,user_attrs_avg_test_score,user_attrs_avg_train_score,user_attrs_test_score_std,user_attrs_train_test_gap,user_attrs_validation_error,state
0,-9999.0,2026-05-10 10:33:23.703537,2026-05-10 10:33:24.058602,0 days 00:00:00.355065,1,NORMAL,0.35,SAME,0.7,4,0.03,0.02,0.6,0.12,12,0.7,5,0.5,,,,,BEAR_RATIO < NEUTRAL_RATIO < BULL_RATIO 约束违反: 0.35 / 0.7 / 0.7,COMPLETE
1,-0.7084285217066206,2026-05-10 10:33:24.080559,2026-05-10 10:42:15.594523,0 days 00:08:51.513964,2,NO_NET_ADD,0.35,SAME,0.7,2,0.05,0.01,0.3,0.16,8,0.5,5,0.65,-0.37766108444916197,-0.09041677346536924,0.6615348745149172,0.2872443109837927,,COMPLETE
2,-0.5865614503926813,2026-05-10 10:42:15.635771,2026-05-10 10:43:20.923078,0 days 00:01:05.287307,0,NO_NET_ADD,0.25,ETF_DEFENSIVE,0.8,2,0.03,0.01,0.45,0.12,12,0.6,10,0.65,-0.25229279001880195,0.08244731133307012,0.6685373207477585,0.33474010135187204,,COMPLETE
3,-9999.0,2026-05-10 10:43:20.947181,2026-05-10 10:43:21.235311,0 days 00:00:00.288130,2,NO_NET_ADD,0.25,ETF_DEFENSIVE,0.7,4,0.03,0.01,0.6,0.08,15,0.7,10,0.65,,,,,BEAR_RATIO < NEUTRAL_RATIO < BULL_RATIO 约束违反: 0.25 / 0.7 / 0.7,COMPLETE
4,-0.5866746804137273,2026-05-10 10:43:21.261213,2026-05-10 10:44:37.513868,0 days 00:01:16.252655,1,CAP_LAYER,0.25,ETF_DEFENSIVE,0.8,2,0.05,0.01,0.45,0.08,8,0.6,5,0.65,-0.30785182554677515,-0.03728065531472078,0.5576457097339044,0.27057117023205435,,COMPLETE
5,-0.17904166071651584,2026-05-10 10:44:37.538141,2026-05-10 10:45:40.444483,0 days 00:01:02.906342,2,CAP_LAYER,0.25,SAME,0.8,2,0.05,0.01,0.3,0.12,12,0.6,10,0.8,,,,,,PRUNED
6,-9999.0,2026-05-10 10:45:40.467223,2026-05-10 10:45:40.765577,0 days 00:00:00.298354,1,NORMAL,0.25,ETF_DEFENSIVE,0.7,3,0.05,0.01,0.3,0.16,5,0.7,10,0.5,,,,,BEAR_RATIO < NEUTRAL_RATIO < BULL_RATIO 约束违反: 0.25 / 0.7 / 0.7,COMPLETE
7,-9999.0,2026-05-10 10:45:40.790069,2026-05-10 10:45:41.074861,0 days 00:00:00.284792,2,CAP_LAYER,0.45,SAME,0.7,4,0.05,0.01,0.3,0.16,5,0.7,20,0.5,,,,,BEAR_RATIO < NEUTRAL_RATIO < BULL_RATIO 约束违反: 0.45 / 0.7 / 0.7,COMPLETE
8,-0.5626759340717213,2026-05-10 10:45:41.098574,2026-05-10 10:48:04.207781,0 days 00:02:23.109207,0,NORMAL,0.45,SAME,0.8,3,0.05,0.02,0.6,0.08,12,0.6,10,0.5,-0.21421712729651926,0.11730022312594998,0.6969176135504042,0.3315173504224692,,COMPLETE
9,-0.1850232061984593,2026-05-10 10:48:04.231475,2026-05-10 10:48:51.343897,0 days 00:00:47.112422,1,NO_NET_ADD,0.35,SAME,0.8,2,0.03,0.02,0.3,0.16,5,0.5,10,0.65,,,,,,PRUNED
10,-0.17186559704076687,2026-05-10 10:48:51.367022,2026-05-10 10:49:37.827326,0 days 00:00:46.460304,0,NORMAL,0.45,SAME,0.8,3,0.05,0.02,0.6,0.08,12,0.6,10,0.8,,,,,,PRUNED
11,-0.25689687055626,2026-05-10 10:49:37.847887,2026-05-10 10:50:17.917339,0 days 00:00:40.069452,0,NO_NET_ADD,0.25,SAME,0.8,4,0.03,0.01,0.45,0.12,5,0.6,10,0.65,,,,,,PRUNED
12,-0.5590330251844128,2026-05-10 10:50:17.941449,2026-05-10 10:53:30.839271,0 days 00:03:12.897822,0,NO_NET_ADD,0.35,ETF_DEFENSIVE,0.7,2,0.03,0.01,0.45,0.12,12,0.6,5,0.65,-0.26644295723144257,0.05493485398735243,0.5851801359059404,0.321377811218795,,COMPLETE
13,-9999.0,2026-05-10 10:53:30.863206,2026-05-10 10:53:31.158992,0 days 00:00:00.295786,0,NO_NET_ADD,0.35,ETF_DEFENSIVE,0.7,2,0.03,0.01,0.45,0.16,10,0.7,5,0.65,,,,,BEAR_RATIO < NEUTRAL_RATIO < BULL_RATIO 约束违反: 0.35 / 0.7 / 0.7,COMPLETE
14,-0.2541345636937814,2026-05-10 10:53:31.182469,2026-05-10 10:54:28.010017,0 days 00:00:56.827548,0,NO_NET_ADD,0.35,ETF_DEFENSIVE,0.7,3,0.03,0.01,0.45,0.12,5,0.6,5,0.65,,,,,,PRUNED
15,-0.5024150354550442,2026-05-10 10:54:28.033653,2026-05-10 10:56:02.977265,0 days 00:01:34.943612,2,CAP_LAYER,0.35,ETF_DEFENSIVE,0.7,2,0.03,0.01,0.6,0.08,12,0.6,5,0.65,-0.2209025737725617,0.07332783827928711,0.5630249233649649,0.2942304120518488,,COMPLETE
16,-0.23144568205346563,2026-05-10 10:56:03.002491,2026-05-10 10:57:05.058767,0 days 00:01:02.056276,2,CAP_LAYER,0.35,ETF_DEFENSIVE,0.7,2,0.03,0.01,0.6,0.08,5,0.6,5,0.8,,,,,,PRUNED
17,-0.5122533534571615,2026-05-10 10:57:05.080351,2026-05-10 10:58:25.136416,0 days 00:01:20.056065,0,CAP_LAYER,0.35,ETF_DEFENSIVE,0.7,2,0.05,0.01,0.45,0.12,12,0.6,5,0.65,-0.22556185152070116,0.06742468994926665,0.5733830038729206,0.29298654146996783,,COMPLETE
18,-0.057449922774708104,2026-05-10 10:58:25.158942,2026-05-10 10:59:09.426207,0 days 00:00:44.267265,2,NO_NET_ADD,0.35,SAME,0.7,2,0.03,0.01,0.6,0.08,12,0.6,20,0.65,,,,,,PRUNED
19,-0.5247733690195839,2026-05-10 10:59:09.450367,2026-05-10 11:00:27.670970,0 days 00:01:18.220603,2,CAP_LAYER,0.35,ETF_DEFENSIVE,0.7,4,0.05,0.01,0.45,0.08,12,0.6,5,0.65,-0.2403446696506639,0.060436698459733255,0.56885739873784,0.30078136811039713,,COMPLETE
20,-0.30393868858866185,2026-05-10 11:00:27.691304,2026-05-10 11:00:56.742143,0 days 00:00:29.050839,0,CAP_LAYER,0.35,ETF_DEFENSIVE,0.7,2,0.05,0.02,0.45,0.12,5,0.6,10,0.65,,,,,,PRUNED
21,-0.0009929532753972792,2026-05-10 11:00:56.765402,2026-05-10 11:01:53.985190,0 days 00:00:57.219788,2,CAP_LAYER,0.25,ETF_DEFENSIVE,0.7,4,0.05,0.01,0.45,0.12,12,0.6,5,0.65,,,,,,PRUNED
22,-0.5051052965149198,2026-05-10 11:01:54.009203,2026-05-10 11:02:47.019491,0 days 00:00:53.010288,2,CAP_LAYER,0.35,ETF_DEFENSIVE,0.7,4,0.03,0.01,0.45,0.08,12,0.6,10,0.65,-0.1742733944985791,0.08426890221058972,0.6616638040326813,0.25854229670916884,,COMPLETE
23,-0.0006232083994116983,2026-05-10 11:02:47.041293,2026-05-10 11:03:55.746797,0 days 00:01:08.705504,0,CAP_LAYER,0.35,ETF_DEFENSIVE,0.8,2,0.05,0.01,0.45,0.12,12,0.5,5,0.5,,,,,,PRUNED
24,-0.5432725694401686,2026-05-10 11:03:55.767832,2026-05-10 11:04:40.446442,0 days 00:00:44.678610,2,NORMAL,0.35,ETF_DEFENSIVE,0.7,4,0.03,0.01,0.6,0.16,12,0.6,10,0.65,-0.19075727953509639,0.03781258569347268,0.7050305798101444,0.22856986522856906,,COMPLETE
25,-0.2773573604874997,2026-05-10 11:04:40.467539,2026-05-10 11:05:40.265857,0 days 00:00:59.798318,1,CAP_LAYER,0.35,ETF_DEFENSIVE,0.7,2,0.05,0.01,0.45,0.12,5,0.6,5,0.8,,,,,,PRUNED
26,-0.48495437073205727,2026-05-10 11:05:40.288024,2026-05-10 11:06:24.557301,0 days 00:00:44.269277,2,CAP_LAYER,0.35,ETF_DEFENSIVE,0.7,3,0.03,0.01,0.45,0.08,12,0.5,10,0.65,-0.18105007556920158,0.061169403987455497,0.6078085903257113,0.24221947955665707,,COMPLETE
27,-0.08974939126832174,2026-05-10 11:06:24.579211,2026-05-10 11:07:06.221810,0 days 00:00:41.642599,2,NO_NET_ADD,0.35,ETF_DEFENSIVE,0.8,4,0.03,0.01,0.45,0.08,12,0.6,10,0.5,,,,,,PRUNED
28,-0.18579628297210754,2026-05-10 11:07:06.239715,2026-05-10 11:07:50.274381,0 days 00:00:44.034666,2,CAP_LAYER,0.35,ETF_DEFENSIVE,0.7,3,0.03,0.01,0.45,0.12,12,0.5,10,0.8,,,,,,PRUNED
29,-9999.0,2026-05-10 11:07:50.295899,2026-05-10 11:07:50.601599,0 days 00:00:00.305700,2,CAP_LAYER,0.45,ETF_DEFENSIVE,0.7,3,0.03,0.01,0.3,0.08,12,0.7,10,0.65,,,,,BEAR_RATIO < NEUTRAL_RATIO < BULL_RATIO 约束违反: 0.45 / 0.7 / 0.7,COMPLETE
30,-9999.0,2026-05-10 11:07:50.623831,2026-05-10 11:07:50.915496,0 days 00:00:00.291665,0,CAP_LAYER,0.35,ETF_DEFENSIVE,0.7,4,0.03,0.01,0.45,0.08,12,0.7,10,0.65,,,,,BEAR_RATIO < NEUTRAL_RATIO < BULL_RATIO 约束违反: 0.35 / 0.7 / 0.7,COMPLETE
31,0.05967048146281201,2026-05-10 11:07:50.961381,2026-05-10 11:08:48.024790,0 days 00:00:57.063409,1,CAP_LAYER,0.35,ETF_DEFENSIVE,0.7,2,0.03,0.01,0.3,0.08,12,0.5,5,0.65,,,,,,PRUNED
32,-0.4972029713051794,2026-05-10 11:08:48.048143,2026-05-10 11:09:32.387194,0 days 00:00:44.339051,2,CAP_LAYER,0.35,ETF_DEFENSIVE,0.8,3,0.03,0.01,0.6,0.08,12,0.5,10,0.65,-0.20259012011090677,0.0724120256868442,0.5892257023885452,0.27500214579775095,,COMPLETE
33,-0.5397655832596808,2026-05-10 11:09:32.412188,2026-05-10 11:10:16.941058,0 days 00:00:44.528870,2,CAP_LAYER,0.35,ETF_DEFENSIVE,0.9,3,0.03,0.02,0.6,0.08,12,0.5,10,0.65,-0.23154487589666187,0.07829607035734676,0.616441414726038,0.3098409462540086,,COMPLETE
34,-0.4294457817755515,2026-05-10 11:10:16.962226,2026-05-10 11:13:11.806172,0 days 00:02:54.843946,2,CAP_LAYER,0.35,SAME,0.7,3,0.05,0.01,0.45,0.08,12,0.5,10,0.65,-0.08562009468846966,0.12157647708169954,0.6876513741741637,0.2071965717701692,,COMPLETE
35,0.07075613240985257,2026-05-10 11:13:11.829377,2026-05-10 11:13:53.297000,0 days 00:00:41.467623,2,CAP_LAYER,0.35,ETF_DEFENSIVE,0.7,3,0.05,0.01,0.45,0.08,10,0.5,10,0.65,,,,,,PRUNED
36,-0.0367218643957815,2026-05-10 11:13:53.319333,2026-05-10 11:14:50.144310,0 days 00:00:56.824977,2,CAP_LAYER,0.25,ETF_DEFENSIVE,0.8,3,0.03,0.01,0.6,0.08,12,0.5,5,0.65,,,,,,PRUNED
37,-0.3947819177135777,2026-05-10 11:14:50.166953,2026-05-10 11:16:05.683443,0 days 00:01:15.516490,2,CAP_LAYER,0.45,SAME,0.7,3,0.05,0.01,0.45,0.08,12,0.5,10,0.65,-0.06018639712934789,0.1312295588241605,0.6691910411684596,0.1914159559535084,,COMPLETE
38,-0.5639681187174457,2026-05-10 11:16:05.705642,2026-05-10 11:17:40.612823,0 days 00:01:34.907181,2,NORMAL,0.45,SAME,0.7,3,0.05,0.01,0.45,0.08,8,0.5,10,0.65,-0.21315736495088106,0.08174376313532468,0.7016215075331292,0.2949011280862057,,COMPLETE
39,-0.554526458847527,2026-05-10 11:17:40.638646,2026-05-10 11:18:56.989586,0 days 00:01:16.350940,2,CAP_LAYER,0.45,SAME,0.9,3,0.05,0.01,0.45,0.16,12,0.5,10,0.65,-0.18874918565840973,0.07864123648758094,0.7315545463782346,0.2673904221459907,,COMPLETE
40,-0.42933673506730863,2026-05-10 11:18:57.013349,2026-05-10 11:20:12.676765,0 days 00:01:15.663416,2,CAP_LAYER,0.35,SAME,0.7,3,0.05,0.02,0.3,0.08,12,0.5,10,0.65,-0.0855488803728407,0.1215609506135289,0.6875757093889359,0.2071098309863696,,COMPLETE
41,-0.17674579847103883,2026-05-10 11:20:12.700342,2026-05-10 11:21:13.376733,0 days 00:01:00.676391,2,CAP_LAYER,0.35,SAME,0.7,3,0.05,0.02,0.3,0.08,12,0.5,10,0.8,,,,,,PRUNED
42,0.05610464291105105,2026-05-10 11:21:13.399389,2026-05-10 11:21:52.585928,0 days 00:00:39.186539,2,CAP_LAYER,0.35,SAME,0.8,3,0.03,0.01,0.45,0.08,12,0.5,20,0.65,,,,,,PRUNED
43,0.07229570090456239,2026-05-10 11:21:52.609685,2026-05-10 11:22:28.396578,0 days 00:00:35.786893,2,CAP_LAYER,0.35,ETF_DEFENSIVE,0.8,3,0.03,0.01,0.6,0.08,5,0.5,10,0.5,,,,,,PRUNED
44,-0.41330879348780836,2026-05-10 11:22:28.421180,2026-05-10 11:23:45.147623,0 days 00:01:16.726443,2,CAP_LAYER,0.45,SAME,0.7,2,0.05,0.01,0.45,0.08,12,0.6,10,0.65,-0.0671717405678881,0.1502139004085253,0.6922741058398405,0.2173856409764134,,COMPLETE
45,-0.41330879348780836,2026-05-10 11:23:45.172482,2026-05-10 11:23:45.705347,0 days 00:00:00.532865,2,CAP_LAYER,0.45,SAME,0.7,2,0.05,0.01,0.45,0.08,12,0.6,10,0.65,-0.0671717405678881,0.1502139004085253,0.6922741058398405,0.2173856409764134,,COMPLETE
46,-0.43102794021009216,2026-05-10 11:23:45.728778,2026-05-10 11:25:00.637789,0 days 00:01:14.909011,2,CAP_LAYER,0.25,SAME,0.7,2,0.05,0.01,0.45,0.08,12,0.6,10,0.65,-0.08972045972239938,0.1537239233039293,0.6826149609753855,0.2434443830263287,,COMPLETE
47,-0.27850889216362906,2026-05-10 11:25:00.660725,2026-05-10 11:25:38.363854,0 days 00:00:37.703129,2,NORMAL,0.45,ETF_DEFENSIVE,0.7,2,0.05,0.01,0.45,0.08,5,0.6,10,0.65,,,,,,PRUNED
48,0.04891743758550379,2026-05-10 11:25:38.385907,2026-05-10 11:26:21.780566,0 days 00:00:43.394659,2,NO_NET_ADD,0.45,SAME,0.7,2,0.05,0.02,0.45,0.08,12,0.5,10,0.65,,,,,,PRUNED
49,-0.5731885485755902,2026-05-10 11:26:21.802200,2026-05-10 11:31:28.174288,0 days 00:05:06.372088,2,CAP_LAYER,0.45,SAME,0.7,2,0.05,0.01,0.6,0.08,8,0.6,5,0.65,-0.1874492765612921,0.05381574011458777,0.7714785440285962,0.24126501667587985,,COMPLETE
50,-0.4569012273685405,2026-05-10 11:31:28.219208,2026-05-10 11:32:43.799758,0 days 00:01:15.580550,2,CAP_LAYER,0.35,SAME,0.7,3,0.05,0.01,0.45,0.12,12,0.5,10,0.65,-0.10546277480842257,0.0988954436665045,0.7028769051202358,0.20435821847492708,,COMPLETE
51,-0.41330879348780836,2026-05-10 11:32:43.847126,2026-05-10 11:32:44.410886,0 days 00:00:00.563760,2,CAP_LAYER,0.45,SAME,0.7,2,0.05,0.01,0.45,0.08,12,0.6,10,0.65,-0.0671717405678881,0.1502139004085253,0.6922741058398405,0.2173856409764134,,COMPLETE
52,-0.12946306324957604,2026-05-10 11:32:44.433254,2026-05-10 11:33:33.929472,0 days 00:00:49.496218,2,CAP_LAYER,0.45,SAME,0.7,2,0.05,0.01,0.45,0.12,15,0.6,20,0.65,,,,,,PRUNED
53,-9999.0,2026-05-10 11:33:33.951489,2026-05-10 11:33:34.266859,0 days 00:00:00.315370,0,CAP_LAYER,0.45,SAME,0.7,2,0.05,0.01,0.3,0.08,12,0.7,10,0.65,,,,,BEAR_RATIO < NEUTRAL_RATIO < BULL_RATIO 约束违反: 0.45 / 0.7 / 0.7,COMPLETE
54,-0.6084598123278051,2026-05-10 11:33:34.288264,2026-05-10 11:34:50.211490,0 days 00:01:15.923226,1,NO_NET_ADD,0.45,SAME,0.7,2,0.05,0.01,0.45,0.12,12,0.6,10,0.65,-0.23509476770251223,0.029244990691413064,0.7467300892505858,0.2643397583939253,,COMPLETE
55,-0.494280794078626,2026-05-10 11:34:50.263286,2026-05-10 11:36:10.274191,0 days 00:01:20.010905,2,NORMAL,0.35,SAME,0.9,4,0.05,0.02,0.3,0.08,12,0.5,10,0.65,-0.15938637131170763,0.12005365333968417,0.6697888455338368,0.2794400246513918,,COMPLETE
56,-0.433605774237527,2026-05-10 11:36:10.298711,2026-05-10 11:37:11.908047,0 days 00:01:01.609336,2,NO_NET_ADD,0.45,SAME,0.7,2,0.05,0.01,0.3,0.08,12,0.6,10,0.8,,,,,,PRUNED
57,-0.6333756748785373,2026-05-10 11:37:11.930136,2026-05-10 11:38:43.189471,0 days 00:01:31.259335,2,CAP_LAYER,0.45,SAME,0.7,2,0.05,0.01,0.45,0.16,8,0.6,10,0.65,-0.2435655869554634,0.062347633415034784,0.7796201758461478,0.3059132203704982,,COMPLETE
58,0.08875441825340016,2026-05-10 11:38:43.214489,2026-05-10 11:42:21.998737,0 days 00:03:38.784248,2,CAP_LAYER,0.45,SAME,0.7,3,0.05,0.01,0.45,0.08,12,0.5,5,0.65,,,,,,PRUNED
59,-0.3845272670238281,2026-05-10 11:42:22.026487,2026-05-10 11:44:03.834561,0 days 00:01:41.808074,2,CAP_LAYER,0.45,SAME,0.8,2,0.05,0.01,0.45,0.08,10,0.6,10,0.65,-0.042875671261223984,0.1434940970869735,0.6833031915252082,0.1863697683481975,,COMPLETE
60,-0.40212069894897057,2026-05-10 11:44:03.860818,2026-05-10 11:45:18.060955,0 days 00:01:14.200137,2,CAP_LAYER,0.45,SAME,0.8,2,0.03,0.01,0.45,0.08,10,0.6,10,0.65,-0.051928966268408275,0.13084940832410105,0.7003834653611246,0.18277837459250934,,COMPLETE
61,-0.425788987501223,2026-05-10 11:45:18.082994,2026-05-10 11:46:32.218907,0 days 00:01:14.135913,2,CAP_LAYER,0.45,SAME,0.8,2,0.05,0.01,0.45,0.08,10,0.7,10,0.65,-0.058837322225262105,0.14973710586207883,0.7339033305519218,0.20857442808734095,,COMPLETE
62,-0.3845272670238281,2026-05-10 11:46:32.244791,2026-05-10 11:46:32.796112,0 days 00:00:00.551321,2,CAP_LAYER,0.45,SAME,0.8,2,0.05,0.01,0.45,0.08,10,0.6,10,0.65,-0.042875671261223984,0.1434940970869735,0.6833031915252082,0.1863697683481975,,COMPLETE
63,-0.46386842126242706,2026-05-10 11:46:32.819257,2026-05-10 11:47:51.885181,0 days 00:01:19.065924,2,CAP_LAYER,0.35,SAME,0.8,2,0.05,0.01,0.45,0.12,10,0.6,10,0.65,-0.11021813987204944,0.11071951138685396,0.7073005627807553,0.2209376512589034,,COMPLETE
64,-0.0824736285690722,2026-05-10 11:47:51.908944,2026-05-10 11:48:39.777615,0 days 00:00:47.868671,1,CAP_LAYER,0.45,SAME,0.8,2,0.05,0.01,0.6,0.08,5,0.6,10,0.65,,,,,,PRUNED
65,-0.40212069894897057,2026-05-10 11:48:39.824097,2026-05-10 11:49:54.170027,0 days 00:01:14.345930,2,NORMAL,0.45,SAME,0.8,2,0.03,0.01,0.45,0.08,10,0.6,10,0.65,-0.051928966268408275,0.13084940832410105,0.7003834653611246,0.18277837459250934,,COMPLETE
66,0.08043527655493729,2026-05-10 11:49:54.194131,2026-05-10 11:50:26.610466,0 days 00:00:32.416335,2,NORMAL,0.45,ETF_DEFENSIVE,0.8,2,0.03,0.01,0.45,0.08,10,0.6,10,0.65,,,,,,PRUNED
67,-0.424935774123553,2026-05-10 11:50:26.633976,2026-05-10 11:52:06.444994,0 days 00:01:39.811018,2,CAP_LAYER,0.45,SAME,0.8,2,0.05,0.01,0.6,0.08,10,0.6,10,0.5,-0.07635006285392955,0.14996435948119766,0.6971714225392469,0.22631442233512722,,COMPLETE
68,-0.40212069894897057,2026-05-10 11:52:06.490126,2026-05-10 11:53:20.742338,0 days 00:01:14.252212,2,CAP_LAYER,0.45,SAME,0.8,2,0.03,0.02,0.45,0.08,10,0.6,10,0.65,-0.051928966268408275,0.13084940832410105,0.7003834653611246,0.18277837459250934,,COMPLETE
69,-0.41015704011986936,2026-05-10 11:53:20.768081,2026-05-10 11:54:35.609720,0 days 00:01:14.841639,2,CAP_LAYER,0.45,SAME,0.8,3,0.03,0.02,0.3,0.08,10,0.6,10,0.65,-0.05363274728141291,0.13338585221698787,0.7130485856769129,0.18701859949840077,,COMPLETE
70,-0.4137230701316777,2026-05-10 11:54:35.635249,2026-05-10 11:55:50.835823,0 days 00:01:15.200574,2,CAP_LAYER,0.45,SAME,0.8,4,0.03,0.02,0.3,0.08,10,0.6,10,0.65,-0.05077506886494476,0.12809872200231373,0.7258960025334659,0.1788737908672585,,COMPLETE
71,-0.45405705520031325,2026-05-10 11:55:50.859462,2026-05-10 11:57:37.940435,0 days 00:01:47.080973,2,CAP_LAYER,0.45,SAME,0.8,2,0.03,0.02,0.45,0.08,12,0.6,10,0.65,-0.09896220936546832,0.15264446103488968,0.7101896916696898,0.251606670400358,,COMPLETE
72,0.05879762562016583,2026-05-10 11:57:37.966023,2026-05-10 11:58:20.477550,0 days 00:00:42.511527,1,NO_NET_ADD,0.45,SAME,0.8,2,0.03,0.01,0.45,0.08,10,0.6,10,0.65,,,,,,PRUNED
73,-0.3700261786150556,2026-05-10 11:58:20.503470,2026-05-10 11:59:29.043845,0 days 00:01:08.540375,2,CAP_LAYER,0.45,SAME,0.8,2,0.03,0.01,0.45,0.08,10,0.6,20,0.5,-0.009200422515220725,0.20058650800798908,0.7216515121996697,0.2097869305232098,,COMPLETE
74,0.1285862920991081,2026-05-10 11:59:29.087855,2026-05-10 12:00:01.479287,0 days 00:00:32.391432,2,CAP_LAYER,0.45,SAME,0.8,2,0.03,0.01,0.3,0.08,10,0.6,20,0.65,,,,,,PRUNED
75,0.21155064171686971,2026-05-10 12:00:01.502976,2026-05-10 12:00:26.357255,0 days 00:00:24.854279,2,CAP_LAYER,0.45,SAME,0.8,4,0.03,0.01,0.45,0.08,10,0.6,20,0.5,,,,,,PRUNED
76,-0.4303363732083702,2026-05-10 12:00:26.380820,2026-05-10 12:01:51.960663,0 days 00:01:25.579843,2,CAP_LAYER,0.45,SAME,0.9,2,0.03,0.01,0.45,0.08,10,0.6,10,0.65,-0.07723787787728119,0.1447582006049204,0.706196990662178,0.2219960784822016,,COMPLETE
77,-0.44133519022961637,2026-05-10 12:01:51.982097,2026-05-10 12:03:06.906442,0 days 00:01:14.924345,2,NORMAL,0.45,SAME,0.9,3,0.03,0.02,0.3,0.08,10,0.6,10,0.65,-0.09410409540622956,0.1265410430106958,0.6944621896467736,0.22064513841692535,,COMPLETE
78,0.15472329666986567,2026-05-10 12:03:06.945675,2026-05-10 12:06:36.386742,0 days 00:03:29.441067,2,CAP_LAYER,0.25,SAME,0.8,2,0.03,0.02,0.45,0.16,10,0.6,5,0.65,,,,,,PRUNED
79,-0.11652104768748714,2026-05-10 12:06:36.409220,2026-05-10 12:07:24.587862,0 days 00:00:48.178642,2,NORMAL,0.25,SAME,0.8,2,0.03,0.01,0.45,0.08,5,0.6,10,0.65,,,,,,PRUNED
80,0.11047849713231508,2026-05-10 12:07:24.610452,2026-05-10 12:07:57.412544,0 days 00:00:32.802092,2,NORMAL,0.45,SAME,0.8,2,0.03,0.01,0.45,0.16,10,0.6,20,0.65,,,,,,PRUNED
81,-9999.0,2026-05-10 12:07:57.436223,2026-05-10 12:07:57.787183,0 days 00:00:00.350960,2,CAP_LAYER,0.45,SAME,0.7,2,0.03,0.01,0.45,0.08,10,0.7,20,0.5,,,,,BEAR_RATIO < NEUTRAL_RATIO < BULL_RATIO 约束违反: 0.45 / 0.7 / 0.7,COMPLETE
82,-0.15096867525198981,2026-05-10 12:07:57.810233,2026-05-10 12:09:00.137841,0 days 00:01:02.327608,2,CAP_LAYER,0.45,SAME,0.8,3,0.05,0.01,0.45,0.08,10,0.6,10,0.8,,,,,,PRUNED
83,-0.1742693556687666,2026-05-10 12:09:00.163807,2026-05-10 12:09:42.077716,0 days 00:00:41.913909,2,CAP_LAYER,0.35,SAME,0.8,2,0.03,0.02,0.45,0.08,10,0.6,10,0.8,,,,,,PRUNED
84,-0.00806743478982272,2026-05-10 12:09:42.101655,2026-05-10 12:10:07.666222,0 days 00:00:25.564567,2,NO_NET_ADD,0.45,SAME,0.8,2,0.05,0.01,0.45,0.08,10,0.6,20,0.65,,,,,,PRUNED
85,0.08144873845858994,2026-05-10 12:10:07.690696,2026-05-10 12:10:42.760394,0 days 00:00:35.069698,2,CAP_LAYER,0.45,ETF_DEFENSIVE,0.8,3,0.03,0.02,0.3,0.08,10,0.7,10,0.65,,,,,,PRUNED
86,-0.4035057864348227,2026-05-10 12:10:43.000307,2026-05-10 12:13:08.290702,0 days 00:02:25.290395,2,NORMAL,0.45,SAME,0.8,2,0.03,0.01,0.45,0.08,10,0.5,10,0.65,-0.06188713132977451,0.12945279820079697,0.6832373102100964,0.1913399295305715,,COMPLETE
87,-0.4035057864348227,2026-05-10 12:13:08.313438,2026-05-10 12:13:08.864817,0 days 00:00:00.551379,2,NORMAL,0.45,SAME,0.8,2,0.03,0.01,0.45,0.08,10,0.5,10,0.65,-0.06188713132977451,0.12945279820079697,0.6832373102100964,0.1913399295305715,,COMPLETE
88,0.2110145823361438,2026-05-10 12:13:08.889677,2026-05-10 12:13:50.802215,0 days 00:00:41.912538,2,NORMAL,0.45,SAME,0.8,2,0.03,0.01,0.45,0.12,10,0.5,10,0.65,,,,,,PRUNED
89,0.1436756010920445,2026-05-10 12:13:50.848437,2026-05-10 12:14:16.085132,0 days 00:00:25.236695,2,NORMAL,0.45,SAME,0.7,2,0.03,0.01,0.45,0.08,10,0.5,20,0.65,,,,,,PRUNED
90,0.05713617847380009,2026-05-10 12:14:16.108226,2026-05-10 12:15:23.663765,0 days 00:01:07.555539,0,NORMAL,0.45,SAME,0.8,2,0.03,0.01,0.45,0.08,15,0.5,10,0.65,,,,,,PRUNED
91,-0.4578911895690503,2026-05-10 12:15:23.707003,2026-05-10 12:16:43.373654,0 days 00:01:19.666651,2,CAP_LAYER,0.45,SAME,0.7,3,0.03,0.02,0.45,0.16,10,0.6,10,0.65,-0.09096808925935022,0.07844997079810315,0.7338462006194001,0.16941806005745336,,COMPLETE
92,-0.4192192883551941,2026-05-10 12:16:43.394542,2026-05-10 12:17:58.102945,0 days 00:01:14.708403,2,CAP_LAYER,0.45,SAME,0.8,4,0.03,0.01,0.45,0.08,10,0.5,10,0.65,-0.06918200455947283,0.12390192020783868,0.7000745675914426,0.1930839247673115,,COMPLETE
93,-0.4322596650966905,2026-05-10 12:17:58.125076,2026-05-10 12:19:38.838534,0 days 00:01:40.713458,2,NORMAL,0.45,SAME,0.8,2,0.03,0.02,0.45,0.08,10,0.5,10,0.5,-0.09790504820318972,0.12703940115552387,0.6687092337870015,0.2249444493587136,,COMPLETE
94,-0.620690944844629,2026-05-10 12:19:38.860221,2026-05-10 12:20:59.563988,0 days 00:01:20.703767,2,CAP_LAYER,0.45,SAME,0.8,2,0.03,0.01,0.45,0.08,5,0.6,10,0.5,-0.23360655067067113,0.020790425665545703,0.7741687883479157,0.25439697633621683,,COMPLETE
