number,value,datetime_start,datetime_complete,duration,params_BEAR_GRID_MAX_LAYER_CAP,params_BEAR_GRID_MODE,params_BEAR_RATIO,params_BEAR_UNIVERSE_MODE,params_BULL_RATIO,params_GRID_MAX_LAYER,params_GRID_STEP_MAX,params_GRID_STEP_MIN,params_GRID_STEP_VOL_FACTOR,params_LAYER_FRACTION,params_MAX_HOLD,params_NEUTRAL_RATIO,params_REBALANCE_FREQ,params_VOL_WEIGHT,user_attrs_avg_test_score,user_attrs_avg_train_score,user_attrs_test_score_std,user_attrs_train_test_gap,user_attrs_validation_error,state
832,0.18718491800570192,2026-05-10 23:06:20.830641,2026-05-10 23:07:13.335235,0 days 00:00:52.504594,0,CAP_LAYER,0.45,SAME,0.7,2,0.05,0.01,0.45,0.12,8,0.5,10,0.65,,,,,,PRUNED
833,-9999.0,2026-05-10 23:07:13.360188,2026-05-10 23:07:13.776170,0 days 00:00:00.415982,0,CAP_LAYER,0.45,ETF_DEFENSIVE,0.7,2,0.05,0.01,0.3,0.12,15,0.7,10,0.65,,,,,BEAR_RATIO < NEUTRAL_RATIO < BULL_RATIO 约束违反: 0.45 / 0.7 / 0.7,COMPLETE
834,-0.346336822181109,2026-05-10 23:07:13.801444,2026-05-10 23:07:14.357912,0 days 00:00:00.556468,0,CAP_LAYER,0.45,SAME,0.7,2,0.05,0.01,0.3,0.08,12,0.5,10,0.65,-0.01879013081234247,0.14858300362277244,0.655093382737533,0.1673731344351149,,COMPLETE
835,0.2698423736186759,2026-05-10 23:07:14.384222,2026-05-10 23:08:12.164397,0 days 00:00:57.780175,0,CAP_LAYER,0.45,SAME,0.7,4,0.05,0.01,0.6,0.08,12,0.5,10,0.65,,,,,,PRUNED
836,-9999.0,2026-05-10 23:08:12.186189,2026-05-10 23:08:12.479105,0 days 00:00:00.292916,0,CAP_LAYER,0.45,SAME,0.7,2,0.05,0.01,0.45,0.08,12,0.7,10,0.5,,,,,BEAR_RATIO < NEUTRAL_RATIO < BULL_RATIO 约束违反: 0.45 / 0.7 / 0.7,COMPLETE
837,0.16359891926441056,2026-05-10 23:08:12.504331,2026-05-10 23:09:00.717912,0 days 00:00:48.213581,0,CAP_LAYER,0.45,SAME,0.7,2,0.05,0.01,0.45,0.12,12,0.5,10,0.5,,,,,,PRUNED
838,0.05836392793940247,2026-05-10 23:09:00.744108,2026-05-10 23:09:30.287370,0 days 00:00:29.543262,0,CAP_LAYER,0.45,ETF_DEFENSIVE,0.7,4,0.05,0.01,0.45,0.08,10,0.5,20,0.65,,,,,,PRUNED
839,0.22297447133711457,2026-05-10 23:09:30.312459,2026-05-10 23:13:07.644811,0 days 00:03:37.332352,0,CAP_LAYER,0.45,SAME,0.7,2,0.05,0.01,0.45,0.08,8,0.5,5,0.65,,,,,,PRUNED
840,-0.11371352068041496,2026-05-10 23:13:07.670325,2026-05-10 23:13:33.093398,0 days 00:00:25.423073,2,CAP_LAYER,0.45,ETF_DEFENSIVE,0.9,3,0.05,0.02,0.6,0.08,8,0.6,20,0.65,,,,,,PRUNED
841,-0.36950129310944024,2026-05-10 23:13:33.113178,2026-05-10 23:13:33.578247,0 days 00:00:00.465069,0,CAP_LAYER,0.45,SAME,0.7,2,0.05,0.01,0.45,0.08,12,0.6,10,0.65,-0.022238277194788054,0.16768886412260414,0.6945260318293044,0.1899271413173922,,COMPLETE
842,-0.0443493802258389,2026-05-10 23:13:33.600523,2026-05-10 23:14:28.824076,0 days 00:00:55.223553,0,CAP_LAYER,0.25,SAME,0.9,4,0.03,0.01,0.45,0.16,15,0.5,20,0.5,,,,,,PRUNED
843,0.17224283271545418,2026-05-10 23:14:28.851817,2026-05-10 23:14:29.258658,0 days 00:00:00.406841,0,CAP_LAYER,0.45,SAME,0.7,2,0.05,0.01,0.45,0.08,8,0.5,10,0.65,,,,,,PRUNED
844,-9999.0,2026-05-10 23:14:29.303823,2026-05-10 23:14:29.660213,0 days 00:00:00.356390,0,CAP_LAYER,0.35,SAME,0.7,3,0.05,0.02,0.45,0.16,5,0.7,20,0.5,,,,,BEAR_RATIO < NEUTRAL_RATIO < BULL_RATIO 约束违反: 0.35 / 0.7 / 0.7,COMPLETE
845,-0.3768516612130329,2026-05-10 23:14:29.683091,2026-05-10 23:17:14.252822,0 days 00:02:44.569731,0,CAP_LAYER,0.45,SAME,0.7,4,0.05,0.01,0.45,0.08,12,0.6,10,0.65,-0.023619524524308218,0.1641345099758544,0.7064642733774493,0.18775403450016262,,COMPLETE
846,-0.1900805959823288,2026-05-10 23:17:14.278534,2026-05-10 23:17:53.240851,0 days 00:00:38.962317,0,CAP_LAYER,0.25,ETF_DEFENSIVE,0.7,2,0.05,0.02,0.3,0.12,15,0.6,20,0.65,,,,,,PRUNED
847,0.2512807499429185,2026-05-10 23:17:53.266736,2026-05-10 23:18:51.836481,0 days 00:00:58.569745,0,NORMAL,0.25,SAME,0.7,2,0.05,0.01,0.45,0.12,10,0.6,10,0.65,,,,,,PRUNED
848,0.11116434001532344,2026-05-10 23:18:51.864417,2026-05-10 23:19:28.010567,0 days 00:00:36.146150,0,CAP_LAYER,0.45,SAME,0.7,2,0.05,0.01,0.45,0.08,12,0.6,20,0.65,,,,,,PRUNED
849,-0.346336822181109,2026-05-10 23:19:28.037079,2026-05-10 23:19:28.586217,0 days 00:00:00.549138,0,CAP_LAYER,0.45,SAME,0.7,2,0.05,0.01,0.45,0.08,12,0.5,10,0.65,-0.01879013081234247,0.14858300362277244,0.655093382737533,0.1673731344351149,,COMPLETE
850,0.1568454709002292,2026-05-10 23:19:28.627511,2026-05-10 23:20:34.452776,0 days 00:01:05.825265,0,CAP_LAYER,0.35,SAME,0.7,2,0.05,0.01,0.45,0.08,12,0.5,10,0.5,,,,,,PRUNED
851,-0.346336822181109,2026-05-10 23:20:34.474887,2026-05-10 23:20:35.034704,0 days 00:00:00.559817,0,CAP_LAYER,0.45,SAME,0.7,2,0.05,0.02,0.45,0.08,12,0.5,10,0.65,-0.01879013081234247,0.14858300362277244,0.655093382737533,0.1673731344351149,,COMPLETE
852,0.014271968007818853,2026-05-10 23:20:35.071699,2026-05-10 23:21:27.320956,0 days 00:00:52.249257,1,NO_NET_ADD,0.25,SAME,0.7,2,0.05,0.01,0.6,0.08,12,0.5,10,0.65,,,,,,PRUNED
853,-0.346336822181109,2026-05-10 23:21:27.346924,2026-05-10 23:21:27.952905,0 days 00:00:00.605981,0,CAP_LAYER,0.45,SAME,0.7,2,0.05,0.01,0.45,0.08,12,0.5,10,0.65,-0.01879013081234247,0.14858300362277244,0.655093382737533,0.1673731344351149,,COMPLETE
854,-0.16583378248487046,2026-05-10 23:21:27.976522,2026-05-10 23:21:58.174324,0 days 00:00:30.197802,2,CAP_LAYER,0.45,ETF_DEFENSIVE,0.8,4,0.03,0.01,0.6,0.16,10,0.6,20,0.8,,,,,,PRUNED
855,-9999.0,2026-05-10 23:21:58.203311,2026-05-10 23:21:58.572806,0 days 00:00:00.369495,0,CAP_LAYER,0.45,SAME,0.7,2,0.05,0.01,0.45,0.08,5,0.7,10,0.65,,,,,BEAR_RATIO < NEUTRAL_RATIO < BULL_RATIO 约束违反: 0.45 / 0.7 / 0.7,COMPLETE
856,-0.15533134455964143,2026-05-10 23:21:58.600116,2026-05-10 23:22:42.498544,0 days 00:00:43.898428,0,NO_NET_ADD,0.25,ETF_DEFENSIVE,0.8,4,0.05,0.01,0.3,0.12,8,0.5,10,0.5,,,,,,PRUNED
857,-0.21016956281682037,2026-05-10 23:22:42.522307,2026-05-10 23:23:14.504535,0 days 00:00:31.982228,0,NO_NET_ADD,0.45,ETF_DEFENSIVE,0.7,3,0.05,0.01,0.3,0.08,12,0.6,20,0.8,,,,,,PRUNED
