number,value,datetime_start,datetime_complete,duration,params_BEAR_GRID_MAX_LAYER_CAP,params_BEAR_GRID_MODE,params_BEAR_RATIO,params_BEAR_UNIVERSE_MODE,params_BULL_RATIO,params_GRID_MAX_LAYER,params_GRID_STEP_MAX,params_GRID_STEP_MIN,params_GRID_STEP_VOL_FACTOR,params_LAYER_FRACTION,params_MAX_HOLD,params_MIN_ANCHORS_IN_POOL,params_NEUTRAL_RATIO,params_REBALANCE_FREQ,params_UNIVERSE_MODE,params_VOL_WEIGHT,user_attrs_avg_test_score,user_attrs_avg_train_score,user_attrs_test_score_std,user_attrs_train_test_gap,user_attrs_validation_error,state
495,0.17210205549906166,2026-05-14 08:42:08.167746,2026-05-14 08:43:17.601935,0 days 00:01:09.434189,0,CAP_LAYER,0.45,SAME,0.7,2,0.05,0.02,0.6,0.08,10,2,0.5,10,WIDE_V2,0.5,,,,,,PRUNED
496,0.2525461417764632,2026-05-14 08:43:17.624940,2026-05-14 08:44:50.867614,0 days 00:01:33.242674,0,CAP_LAYER,0.45,SAME,0.7,2,0.05,0.02,0.3,0.08,3,2,0.6,5,WIDE_V2,0.5,,,,,,PRUNED
497,-0.3624410536385451,2026-05-14 08:44:50.896356,2026-05-14 08:45:00.485968,0 days 00:00:09.589612,0,NORMAL,0.45,SAME,0.7,2,0.05,0.02,0.6,0.08,3,2,0.5,5,ANCHOR_SATELLITE,0.5,,,,,,PRUNED
498,0.17404672480472605,2026-05-14 08:45:00.512976,2026-05-14 08:46:24.990832,0 days 00:01:24.477856,0,CAP_LAYER,0.25,SAME,0.8,3,0.05,0.02,0.6,0.08,3,2,0.5,5,WIDE_V2,0.5,,,,,,PRUNED
499,-9999.0,2026-05-14 08:46:25.015101,2026-05-14 08:46:25.375862,0 days 00:00:00.360761,0,CAP_LAYER,0.45,SAME,0.7,2,0.05,0.02,0.6,0.08,3,2,0.7,5,ANCHOR_SATELLITE,0.5,,,,,BEAR_RATIO < NEUTRAL_RATIO < BULL_RATIO 约束违反: 0.45 / 0.7 / 0.7,COMPLETE
500,0.14364607974924487,2026-05-14 08:46:25.400710,2026-05-14 08:48:02.330841,0 days 00:01:36.930131,0,CAP_LAYER,0.45,SAME,0.7,2,0.05,0.02,0.6,0.08,5,2,0.5,5,WIDE_V2,0.65,,,,,,PRUNED
501,-9999.0,2026-05-14 08:48:02.358581,2026-05-14 08:48:02.728117,0 days 00:00:00.369536,0,CAP_LAYER,0.45,SAME,0.7,2,0.05,0.02,0.6,0.08,8,2,0.7,5,WIDE_V2,0.8,,,,,BEAR_RATIO < NEUTRAL_RATIO < BULL_RATIO 约束违反: 0.45 / 0.7 / 0.7,COMPLETE
502,0.17101668917386437,2026-05-14 08:48:02.753450,2026-05-14 08:48:51.559046,0 days 00:00:48.805596,0,CAP_LAYER,0.45,SAME,0.9,2,0.05,0.02,0.6,0.08,3,2,0.5,10,WIDE_V2,0.5,,,,,,PRUNED
503,0.23581551128132827,2026-05-14 08:48:51.584444,2026-05-14 08:50:15.456704,0 days 00:01:23.872260,0,NORMAL,0.35,SAME,0.7,2,0.05,0.02,0.6,0.08,3,2,0.5,5,WIDE_V2,0.5,,,,,,PRUNED
504,0.1902964184248452,2026-05-14 08:50:15.483793,2026-05-14 08:51:43.917852,0 days 00:01:28.434059,1,CAP_LAYER,0.45,SAME,0.7,2,0.05,0.02,0.6,0.08,3,2,0.5,5,WIDE_V2,0.8,,,,,,PRUNED
505,0.0659194981313123,2026-05-14 08:51:43.943137,2026-05-14 08:52:44.200491,0 days 00:01:00.257354,0,CAP_LAYER,0.45,ETF_DEFENSIVE,0.7,2,0.05,0.02,0.45,0.08,3,2,0.5,5,WIDE_V2,0.5,,,,,,PRUNED
506,0.2504416468491144,2026-05-14 08:52:44.229598,2026-05-14 08:54:17.627505,0 days 00:01:33.397907,1,CAP_LAYER,0.45,SAME,0.7,2,0.05,0.02,0.45,0.08,3,1,0.5,5,WIDE_V2,0.5,,,,,,PRUNED
507,-0.358548887236271,2026-05-14 08:54:17.653747,2026-05-14 08:58:50.639512,0 days 00:04:32.985765,1,CAP_LAYER,0.45,SAME,0.7,2,0.05,0.02,0.6,0.08,3,1,0.5,5,WIDE_V2,0.65,-0.02511646492045069,0.04764909670323224,0.6668648446316406,0.07276556162368293,,COMPLETE
508,-0.23720860177620176,2026-05-14 08:58:50.666721,2026-05-14 08:59:17.193837,0 days 00:00:26.527116,0,CAP_LAYER,0.45,SAME,0.7,4,0.05,0.02,0.6,0.08,3,2,0.5,20,WIDE_V2,0.65,,,,,,PRUNED
509,-0.3574296867331643,2026-05-14 08:59:17.219633,2026-05-14 08:59:27.702358,0 days 00:00:10.482725,0,CAP_LAYER,0.45,SAME,0.7,2,0.05,0.02,0.6,0.08,3,2,0.5,5,ANCHOR_SATELLITE,0.8,,,,,,PRUNED
510,-0.5124121817753802,2026-05-14 08:59:27.727391,2026-05-14 08:59:33.346485,0 days 00:00:05.619094,0,CAP_LAYER,0.25,SAME,0.7,2,0.05,0.02,0.6,0.08,3,2,0.5,5,ANCHOR_SATELLITE,0.5,,,,,,PRUNED
511,-0.348826446529591,2026-05-14 08:59:33.372535,2026-05-14 09:01:57.671933,0 days 00:02:24.299398,0,CAP_LAYER,0.45,SAME,0.7,2,0.05,0.02,0.45,0.08,3,2,0.5,5,WIDE_V2,0.65,-0.021232264479312257,0.046847227582617286,0.6551883641005575,0.06807949206192954,,COMPLETE
512,0.20945141753870183,2026-05-14 09:01:57.694793,2026-05-14 09:03:20.052127,0 days 00:01:22.357334,1,CAP_LAYER,0.45,SAME,0.7,2,0.05,0.02,0.6,0.16,3,2,0.5,5,WIDE_V2,0.5,,,,,,PRUNED
513,0.25099239456903844,2026-05-14 09:03:20.076961,2026-05-14 09:04:49.449323,0 days 00:01:29.372362,0,NORMAL,0.45,SAME,0.7,2,0.05,0.01,0.6,0.08,3,2,0.5,5,WIDE_V2,0.5,,,,,,PRUNED
514,0.15826719611276166,2026-05-14 09:04:49.483277,2026-05-14 09:06:09.614842,0 days 00:01:20.131565,0,NO_NET_ADD,0.35,SAME,0.7,2,0.05,0.02,0.6,0.08,3,2,0.6,5,WIDE_V2,0.5,,,,,,PRUNED
515,-9999.0,2026-05-14 09:06:09.638619,2026-05-14 09:06:09.989454,0 days 00:00:00.350835,0,CAP_LAYER,0.35,SAME,0.7,2,0.05,0.02,0.45,0.08,3,2,0.7,20,WIDE_V2,0.8,,,,,BEAR_RATIO < NEUTRAL_RATIO < BULL_RATIO 约束违反: 0.35 / 0.7 / 0.7,COMPLETE
516,0.11561697154854544,2026-05-14 09:06:10.013989,2026-05-14 09:07:51.524924,0 days 00:01:41.510935,0,CAP_LAYER,0.25,SAME,0.7,2,0.05,0.02,0.6,0.08,10,2,0.6,5,WIDE_V2,0.5,,,,,,PRUNED
517,0.13652543627613148,2026-05-14 09:07:51.549687,2026-05-14 09:08:30.736986,0 days 00:00:39.187299,0,CAP_LAYER,0.45,SAME,0.7,2,0.05,0.02,0.6,0.08,8,2,0.5,20,WIDE_V2,0.5,,,,,,PRUNED
518,-0.5895478569354613,2026-05-14 09:08:30.763697,2026-05-14 09:12:31.757601,0 days 00:04:00.993904,0,NO_NET_ADD,0.45,SAME,0.7,3,0.05,0.02,0.6,0.08,6,2,0.5,5,WIDE_V2,0.5,-0.204134391440202,0.04235005477619719,0.7708269309905185,0.2464844462163992,,COMPLETE
519,0.1455602320444063,2026-05-14 09:12:31.783432,2026-05-14 09:13:51.216305,0 days 00:01:19.432873,0,CAP_LAYER,0.45,SAME,0.7,2,0.05,0.01,0.6,0.08,10,2,0.5,5,WIDE_V2,0.5,,,,,,PRUNED
520,0.25051066914041914,2026-05-14 09:13:51.241506,2026-05-14 09:15:13.727458,0 days 00:01:22.485952,0,CAP_LAYER,0.45,SAME,0.7,2,0.03,0.02,0.6,0.08,3,1,0.5,5,WIDE_V2,0.5,,,,,,PRUNED
521,-0.5128078427489109,2026-05-14 09:15:13.751498,2026-05-14 09:15:33.946848,0 days 00:00:20.195350,0,CAP_LAYER,0.45,SAME,0.7,2,0.05,0.02,0.6,0.08,10,2,0.5,5,ANCHOR_SATELLITE,0.5,,,,,,PRUNED
522,-0.3497363192710759,2026-05-14 09:15:33.970009,2026-05-14 09:17:50.469585,0 days 00:02:16.499576,0,CAP_LAYER,0.45,SAME,0.7,2,0.03,0.02,0.6,0.08,3,2,0.5,5,WIDE_V2,0.65,-0.019912436579963617,0.04560171496660478,0.6596477653822246,0.0655141515465684,,COMPLETE
523,-9999.0,2026-05-14 09:17:50.497182,2026-05-14 09:17:50.870756,0 days 00:00:00.373574,0,CAP_LAYER,0.45,SAME,0.7,2,0.05,0.02,0.6,0.16,4,2,0.7,5,WIDE_V2,0.5,,,,,BEAR_RATIO < NEUTRAL_RATIO < BULL_RATIO 约束违反: 0.45 / 0.7 / 0.7,COMPLETE
524,-0.032691496584967006,2026-05-14 09:17:50.895632,2026-05-14 09:18:15.042237,0 days 00:00:24.146605,0,CAP_LAYER,0.45,SAME,0.7,4,0.05,0.02,0.6,0.08,3,2,0.5,20,WIDE_V2,0.5,,,,,,PRUNED
525,0.06564688251788847,2026-05-14 09:18:15.066519,2026-05-14 09:19:09.048148,0 days 00:00:53.981629,0,CAP_LAYER,0.45,ETF_DEFENSIVE,0.7,2,0.05,0.02,0.6,0.08,3,2,0.5,5,WIDE_V2,0.65,,,,,,PRUNED
526,-0.311943513174594,2026-05-14 09:19:09.071564,2026-05-14 09:19:09.896008,0 days 00:00:00.824444,0,CAP_LAYER,0.45,SAME,0.7,2,0.05,0.02,0.6,0.08,3,2,0.5,5,WIDE_V2,0.5,-0.03503602807514746,0.0022846139529225295,0.5538149701988931,0.03732064202806999,,COMPLETE
527,-0.37440618004679577,2026-05-14 09:19:09.920213,2026-05-14 09:21:34.414587,0 days 00:02:24.494374,0,CAP_LAYER,0.45,SAME,0.7,2,0.05,0.02,0.6,0.12,4,2,0.5,5,WIDE_V2,0.5,-0.027468972781854513,0.13265659150387232,0.6938744145298825,0.16012556428572683,,COMPLETE
528,0.2480339546150649,2026-05-14 09:21:34.438629,2026-05-14 09:22:52.772817,0 days 00:01:18.334188,0,CAP_LAYER,0.45,SAME,0.7,4,0.05,0.02,0.45,0.08,3,2,0.5,5,WIDE_V2,0.5,,,,,,PRUNED
529,0.1390044218608806,2026-05-14 09:22:52.798972,2026-05-14 09:24:08.518589,0 days 00:01:15.719617,0,NORMAL,0.45,SAME,0.7,4,0.05,0.02,0.6,0.08,3,2,0.5,5,WIDE_V2,0.8,,,,,,PRUNED
530,0.11178426039804523,2026-05-14 09:24:08.542151,2026-05-14 09:25:38.014369,0 days 00:01:29.472218,0,CAP_LAYER,0.25,SAME,0.9,2,0.03,0.02,0.6,0.08,6,2,0.5,5,WIDE_V2,0.65,,,,,,PRUNED
531,-0.4992301338270982,2026-05-14 09:25:38.035283,2026-05-14 09:26:58.670074,0 days 00:01:20.634791,0,NO_NET_ADD,0.45,SAME,0.7,2,0.05,0.02,0.6,0.08,5,2,0.5,10,WIDE_V2,0.5,-0.10274602215963784,0.11243961807210441,0.7929682233349207,0.21518564023174225,,COMPLETE
532,0.05111098829532111,2026-05-14 09:26:58.697149,2026-05-14 09:28:16.538494,0 days 00:01:17.841345,1,NO_NET_ADD,0.45,SAME,0.7,2,0.05,0.02,0.6,0.08,6,2,0.5,5,WIDE_V2,0.65,,,,,,PRUNED
533,-0.010465234969202625,2026-05-14 09:28:16.563129,2026-05-14 09:28:43.363328,0 days 00:00:26.800199,0,CAP_LAYER,0.45,SAME,0.7,2,0.05,0.01,0.6,0.08,3,2,0.5,20,WIDE_V2,0.5,,,,,,PRUNED
534,0.24709599457908385,2026-05-14 09:28:43.385896,2026-05-14 09:29:58.938388,0 days 00:01:15.552492,0,CAP_LAYER,0.35,SAME,0.7,2,0.05,0.02,0.6,0.08,3,2,0.5,5,WIDE_V2,0.65,,,,,,PRUNED
535,0.17739083762608587,2026-05-14 09:29:58.962670,2026-05-14 09:31:19.363969,0 days 00:01:20.401299,0,CAP_LAYER,0.25,SAME,0.9,2,0.05,0.02,0.6,0.08,3,2,0.5,5,WIDE_V2,0.5,,,,,,PRUNED
536,0.1750152396470641,2026-05-14 09:31:19.387474,2026-05-14 09:32:00.107237,0 days 00:00:40.719763,0,CAP_LAYER,0.45,SAME,0.7,2,0.05,0.02,0.6,0.08,3,1,0.5,10,WIDE_V2,0.5,,,,,,PRUNED
537,-0.3625661845898867,2026-05-14 09:32:00.130493,2026-05-14 09:32:11.766358,0 days 00:00:11.635865,0,CAP_LAYER,0.45,SAME,0.7,2,0.03,0.02,0.6,0.08,3,2,0.5,5,ANCHOR_SATELLITE,0.5,,,,,,PRUNED
538,0.1069727882206654,2026-05-14 09:32:11.791296,2026-05-14 09:32:48.820224,0 days 00:00:37.028928,0,CAP_LAYER,0.25,SAME,0.7,2,0.05,0.02,0.45,0.08,3,2,0.5,10,WIDE_V2,0.5,,,,,,PRUNED
539,0.23464210080097342,2026-05-14 09:32:48.843921,2026-05-14 09:34:04.915850,0 days 00:01:16.071929,0,NORMAL,0.45,SAME,0.7,3,0.05,0.02,0.6,0.08,3,2,0.6,5,WIDE_V2,0.5,,,,,,PRUNED
540,-0.5413628412780909,2026-05-14 09:34:04.937893,2026-05-14 09:34:11.309942,0 days 00:00:06.372049,0,CAP_LAYER,0.45,ETF_DEFENSIVE,0.7,2,0.05,0.02,0.6,0.08,3,2,0.5,5,ANCHOR_SATELLITE,0.5,,,,,,PRUNED
541,0.17406387126284495,2026-05-14 09:34:11.335190,2026-05-14 09:34:48.396658,0 days 00:00:37.061468,0,NORMAL,0.45,SAME,0.7,2,0.05,0.02,0.6,0.08,3,2,0.5,10,WIDE_V2,0.5,,,,,,PRUNED
542,-0.507046717391758,2026-05-14 09:34:48.421023,2026-05-14 09:38:48.436348,0 days 00:04:00.015325,0,CAP_LAYER,0.45,SAME,0.7,2,0.05,0.02,0.45,0.08,6,2,0.5,5,WIDE_V2,0.5,-0.11553796387236534,0.06851263702844093,0.7830175070387853,0.18405060090080627,,COMPLETE
543,0.12485237520172413,2026-05-14 09:38:48.463341,2026-05-14 09:40:20.796694,0 days 00:01:32.333353,0,CAP_LAYER,0.45,SAME,0.9,2,0.05,0.02,0.6,0.08,10,1,0.5,5,WIDE_V2,0.5,,,,,,PRUNED
544,-0.3704932253351757,2026-05-14 09:40:20.819575,2026-05-14 09:42:45.247049,0 days 00:02:24.427474,0,CAP_LAYER,0.45,SAME,0.7,2,0.05,0.02,0.3,0.08,4,2,0.5,5,WIDE_V2,0.5,-0.02348578046968965,0.14780280096490886,0.6940148897309721,0.17128858143459852,,COMPLETE
545,-0.05327786204482862,2026-05-14 09:42:45.271185,2026-05-14 09:43:26.717168,0 days 00:00:41.445983,0,CAP_LAYER,0.45,SAME,0.7,2,0.05,0.02,0.6,0.08,3,2,0.6,10,WIDE_V2,0.8,,,,,,PRUNED
546,-0.005646618341972581,2026-05-14 09:43:26.741339,2026-05-14 09:43:51.726518,0 days 00:00:24.985179,0,CAP_LAYER,0.45,SAME,0.7,2,0.03,0.02,0.6,0.08,3,2,0.5,20,WIDE_V2,0.5,,,,,,PRUNED
547,-0.01430606679117788,2026-05-14 09:43:51.749778,2026-05-14 09:44:14.313256,0 days 00:00:22.563478,0,CAP_LAYER,0.45,SAME,0.9,2,0.05,0.02,0.3,0.08,3,2,0.5,20,WIDE_V2,0.5,,,,,,PRUNED
548,-0.5142344172942906,2026-05-14 09:44:14.339368,2026-05-14 09:46:35.048063,0 days 00:02:20.708695,0,CAP_LAYER,0.45,SAME,0.8,3,0.05,0.02,0.6,0.08,5,2,0.7,5,WIDE_V2,0.5,-0.1304987174733874,0.07807254435190958,0.7674713996418066,0.20857126182529698,,COMPLETE
549,-0.0037673626133946925,2026-05-14 09:46:35.072074,2026-05-14 09:46:58.185177,0 days 00:00:23.113103,1,CAP_LAYER,0.45,SAME,0.7,2,0.05,0.02,0.3,0.08,3,2,0.5,20,WIDE_V2,0.5,,,,,,PRUNED
550,-0.5205421481651569,2026-05-14 09:46:58.224577,2026-05-14 09:49:15.722764,0 days 00:02:17.498187,0,CAP_LAYER,0.25,SAME,0.7,4,0.05,0.02,0.6,0.08,5,2,0.5,5,WIDE_V2,0.5,-0.15971307608790283,0.017113357562133995,0.721658144154508,0.17682643365003683,,COMPLETE
551,0.17738812778971788,2026-05-14 09:49:15.749607,2026-05-14 09:50:37.743362,0 days 00:01:21.993755,0,CAP_LAYER,0.45,SAME,0.9,2,0.05,0.01,0.6,0.08,4,2,0.7,5,WIDE_V2,0.65,,,,,,PRUNED
552,-0.008237495707240694,2026-05-14 09:50:37.768800,2026-05-14 09:51:00.261918,0 days 00:00:22.493118,0,NORMAL,0.45,SAME,0.7,2,0.05,0.02,0.3,0.08,3,2,0.5,20,WIDE_V2,0.5,,,,,,PRUNED
553,0.24160416006574287,2026-05-14 09:51:00.301538,2026-05-14 09:52:25.510383,0 days 00:01:25.208845,0,CAP_LAYER,0.45,SAME,0.7,2,0.05,0.02,0.6,0.08,8,2,0.5,5,WIDE_V2,0.65,,,,,,PRUNED
554,-0.021198787113102163,2026-05-14 09:52:25.532375,2026-05-14 09:52:53.044768,0 days 00:00:27.512393,0,CAP_LAYER,0.45,SAME,0.7,3,0.05,0.02,0.3,0.08,3,2,0.5,20,WIDE_V2,0.5,,,,,,PRUNED
555,-0.37626036166062476,2026-05-14 09:52:53.071707,2026-05-14 09:55:14.625310,0 days 00:02:21.553603,0,CAP_LAYER,0.45,SAME,0.7,3,0.05,0.02,0.6,0.08,4,2,0.5,5,WIDE_V2,0.5,-0.028148752211960244,0.13551199736161387,0.6962232188973291,0.16366074957357413,,COMPLETE
556,-0.311943513174594,2026-05-14 09:55:14.648235,2026-05-14 09:55:15.267595,0 days 00:00:00.619360,0,CAP_LAYER,0.45,SAME,0.7,2,0.05,0.02,0.6,0.08,3,2,0.5,5,WIDE_V2,0.5,-0.03503602807514746,0.0022846139529225295,0.5538149701988931,0.03732064202806999,,COMPLETE
557,-0.37023990794554046,2026-05-14 09:55:15.290799,2026-05-14 09:55:26.688237,0 days 00:00:11.397438,0,CAP_LAYER,0.45,SAME,0.8,2,0.05,0.02,0.6,0.08,3,2,0.5,5,ANCHOR_SATELLITE,0.5,,,,,,PRUNED
558,0.0659194981313123,2026-05-14 09:55:26.712282,2026-05-14 09:56:22.417151,0 days 00:00:55.704869,0,CAP_LAYER,0.45,ETF_DEFENSIVE,0.7,2,0.05,0.02,0.3,0.08,3,1,0.5,5,WIDE_V2,0.5,,,,,,PRUNED
559,0.2328704111777638,2026-05-14 09:56:22.440856,2026-05-14 09:57:37.618286,0 days 00:01:15.177430,0,CAP_LAYER,0.45,SAME,0.7,2,0.05,0.02,0.6,0.12,3,2,0.6,5,WIDE_V2,0.5,,,,,,PRUNED
560,-0.311943513174594,2026-05-14 09:57:37.644690,2026-05-14 09:57:38.211414,0 days 00:00:00.566724,0,CAP_LAYER,0.45,SAME,0.7,2,0.05,0.02,0.6,0.08,3,2,0.5,5,WIDE_V2,0.5,-0.03503602807514746,0.0022846139529225295,0.5538149701988931,0.03732064202806999,,COMPLETE
561,-0.311943513174594,2026-05-14 09:57:38.251772,2026-05-14 09:57:38.939539,0 days 00:00:00.687767,0,CAP_LAYER,0.45,SAME,0.7,2,0.05,0.01,0.6,0.08,3,2,0.5,5,WIDE_V2,0.5,-0.03503602807514746,0.0022846139529225295,0.5538149701988931,0.03732064202806999,,COMPLETE
562,-0.12775496493445815,2026-05-14 09:57:38.963076,2026-05-14 09:58:11.861419,0 days 00:00:32.898343,0,CAP_LAYER,0.45,ETF_DEFENSIVE,0.7,2,0.05,0.02,0.6,0.08,3,2,0.5,10,WIDE_V2,0.5,,,,,,PRUNED
563,0.05184947787817408,2026-05-14 09:58:11.887674,2026-05-14 09:59:07.378806,0 days 00:00:55.491132,0,CAP_LAYER,0.45,ETF_DEFENSIVE,0.8,2,0.05,0.02,0.6,0.08,3,2,0.5,5,WIDE_V2,0.5,,,,,,PRUNED
564,-0.39123102480848493,2026-05-14 09:59:07.402975,2026-05-14 10:01:19.707767,0 days 00:02:12.304792,0,CAP_LAYER,0.45,SAME,0.7,2,0.05,0.02,0.6,0.08,4,2,0.6,5,WIDE_V2,0.5,-0.02961811469117797,0.16474197072257682,0.7232258202346139,0.1943600854137548,,COMPLETE
565,0.22950465886780044,2026-05-14 10:01:19.731547,2026-05-14 10:02:35.032966,0 days 00:01:15.301419,0,CAP_LAYER,0.45,SAME,0.9,2,0.05,0.02,0.6,0.08,3,2,0.6,5,WIDE_V2,0.5,,,,,,PRUNED
566,0.2421225748222017,2026-05-14 10:02:35.056211,2026-05-14 10:03:48.744570,0 days 00:01:13.688359,0,NORMAL,0.45,SAME,0.7,3,0.05,0.02,0.6,0.08,3,2,0.5,5,WIDE_V2,0.5,,,,,,PRUNED
567,0.23799538709797766,2026-05-14 10:03:48.767579,2026-05-14 10:05:23.268558,0 days 00:01:34.500979,0,CAP_LAYER,0.45,SAME,0.7,2,0.05,0.02,0.6,0.08,8,1,0.5,5,WIDE_V2,0.5,,,,,,PRUNED
568,0.1750152396470641,2026-05-14 10:05:23.292305,2026-05-14 10:06:03.655186,0 days 00:00:40.362881,0,CAP_LAYER,0.45,SAME,0.7,2,0.05,0.02,0.3,0.08,3,2,0.5,10,WIDE_V2,0.5,,,,,,PRUNED
569,-0.5294838727341715,2026-05-14 10:06:03.681125,2026-05-14 10:08:27.322683,0 days 00:02:23.641558,0,CAP_LAYER,0.45,SAME,0.9,2,0.05,0.02,0.6,0.08,6,2,0.5,5,WIDE_V2,0.5,-0.13672837598344784,0.06014097133817703,0.7855109935014475,0.19686934732162487,,COMPLETE
570,-0.5245888856999317,2026-05-14 10:08:27.347655,2026-05-14 10:10:47.806766,0 days 00:02:20.459111,0,NORMAL,0.45,SAME,0.7,2,0.05,0.02,0.6,0.08,6,2,0.5,5,WIDE_V2,0.5,-0.1235557435667233,0.06014070245268384,0.8020662842664168,0.18369644601940716,,COMPLETE
571,0.14079589793050026,2026-05-14 10:10:47.831626,2026-05-14 10:11:27.572060,0 days 00:00:39.740434,0,CAP_LAYER,0.35,SAME,0.7,2,0.05,0.02,0.6,0.08,3,2,0.5,10,WIDE_V2,0.5,,,,,,PRUNED
572,-9999.0,2026-05-14 10:11:27.592815,2026-05-14 10:11:27.932299,0 days 00:00:00.339484,0,NORMAL,0.45,SAME,0.7,2,0.05,0.02,0.6,0.08,3,2,0.7,5,WIDE_V2,0.5,,,,,BEAR_RATIO < NEUTRAL_RATIO < BULL_RATIO 约束违反: 0.45 / 0.7 / 0.7,COMPLETE
573,0.2341731248582664,2026-05-14 10:11:27.956187,2026-05-14 10:12:41.236024,0 days 00:01:13.279837,0,CAP_LAYER,0.45,SAME,0.9,2,0.05,0.02,0.6,0.08,3,1,0.5,5,WIDE_V2,0.5,,,,,,PRUNED
574,0.09637980587483108,2026-05-14 10:12:41.259153,2026-05-14 10:14:15.298798,0 days 00:01:34.039645,0,CAP_LAYER,0.25,SAME,0.7,2,0.05,0.02,0.6,0.08,10,1,0.5,5,WIDE_V2,0.5,,,,,,PRUNED
575,0.20913504784485026,2026-05-14 10:14:15.324145,2026-05-14 10:15:28.685975,0 days 00:01:13.361830,0,NO_NET_ADD,0.45,SAME,0.9,2,0.05,0.02,0.3,0.08,3,2,0.5,5,WIDE_V2,0.5,,,,,,PRUNED
576,0.2480339546150649,2026-05-14 10:15:28.729570,2026-05-14 10:16:49.852901,0 days 00:01:21.123331,0,CAP_LAYER,0.45,SAME,0.7,4,0.05,0.02,0.3,0.08,3,2,0.5,5,WIDE_V2,0.5,,,,,,PRUNED
577,-0.3799662723409833,2026-05-14 10:16:49.877825,2026-05-14 10:19:07.363217,0 days 00:02:17.485392,0,CAP_LAYER,0.45,SAME,0.8,2,0.05,0.02,0.6,0.08,4,2,0.5,5,WIDE_V2,0.5,-0.03510861794756764,0.13036491191838925,0.6897153087868313,0.1654735298659569,,COMPLETE
578,0.11229850746570305,2026-05-14 10:19:07.387681,2026-05-14 10:20:39.110509,0 days 00:01:31.722828,0,NO_NET_ADD,0.45,SAME,0.9,2,0.05,0.02,0.6,0.08,8,2,0.7,5,WIDE_V2,0.5,,,,,,PRUNED
579,0.1637283961617213,2026-05-14 10:20:39.130081,2026-05-14 10:22:00.512944,0 days 00:01:21.382863,0,CAP_LAYER,0.45,SAME,0.7,2,0.05,0.02,0.6,0.08,3,2,0.6,5,WIDE_V2,0.8,,,,,,PRUNED
580,0.2215407270468848,2026-05-14 10:22:00.534410,2026-05-14 10:23:16.034551,0 days 00:01:15.500141,0,CAP_LAYER,0.35,SAME,0.7,3,0.05,0.02,0.6,0.08,3,2,0.5,5,WIDE_V2,0.5,,,,,,PRUNED
581,0.24488738753482378,2026-05-14 10:23:16.056458,2026-05-14 10:24:34.062756,0 days 00:01:18.006298,1,CAP_LAYER,0.45,SAME,0.7,2,0.05,0.02,0.6,0.08,3,2,0.6,5,WIDE_V2,0.5,,,,,,PRUNED
582,-0.311943513174594,2026-05-14 10:24:34.084670,2026-05-14 10:24:34.697827,0 days 00:00:00.613157,0,CAP_LAYER,0.45,SAME,0.7,2,0.05,0.02,0.6,0.08,3,2,0.5,5,WIDE_V2,0.5,-0.03503602807514746,0.0022846139529225295,0.5538149701988931,0.03732064202806999,,COMPLETE
583,0.20168383222056308,2026-05-14 10:24:34.721274,2026-05-14 10:25:47.667398,0 days 00:01:12.946124,0,CAP_LAYER,0.45,SAME,0.9,2,0.05,0.02,0.6,0.16,3,2,0.5,5,WIDE_V2,0.5,,,,,,PRUNED
584,0.03169862607439474,2026-05-14 10:25:47.689519,2026-05-14 10:26:42.880791,0 days 00:00:55.191272,0,CAP_LAYER,0.35,ETF_DEFENSIVE,0.7,2,0.05,0.02,0.6,0.08,3,2,0.5,5,WIDE_V2,0.5,,,,,,PRUNED
585,-0.35881573152192847,2026-05-14 10:26:42.905308,2026-05-14 10:29:04.223504,0 days 00:02:21.318196,0,CAP_LAYER,0.45,SAME,0.7,3,0.05,0.02,0.6,0.08,3,2,0.5,5,WIDE_V2,0.65,-0.028578386006562356,0.03707752316142681,0.6604746910307322,0.06565590916798916,,COMPLETE
586,-0.3900962012788534,2026-05-14 10:29:04.248314,2026-05-14 10:29:15.672325,0 days 00:00:11.424011,0,CAP_LAYER,0.45,SAME,0.7,2,0.05,0.02,0.6,0.08,3,2,0.6,5,ANCHOR_SATELLITE,0.5,,,,,,PRUNED
587,-0.4424484544011475,2026-05-14 10:29:15.699175,2026-05-14 10:29:20.784600,0 days 00:00:05.085425,0,NO_NET_ADD,0.45,SAME,0.7,2,0.05,0.02,0.6,0.08,3,2,0.5,5,ANCHOR_SATELLITE,0.5,,,,,,PRUNED
588,0.1909963396336679,2026-05-14 10:29:20.830497,2026-05-14 10:30:32.881034,0 days 00:01:12.050537,0,NO_NET_ADD,0.45,SAME,0.9,3,0.05,0.02,0.6,0.08,3,2,0.5,5,WIDE_V2,0.5,,,,,,PRUNED
589,0.21688645515571847,2026-05-14 10:30:32.907106,2026-05-14 10:31:48.448467,0 days 00:01:15.541361,0,CAP_LAYER,0.45,SAME,0.7,2,0.03,0.02,0.6,0.16,3,2,0.5,5,WIDE_V2,0.5,,,,,,PRUNED
590,-0.20039030979909028,2026-05-14 10:31:48.472390,2026-05-14 10:31:57.928797,0 days 00:00:09.456407,0,CAP_LAYER,0.45,SAME,0.9,2,0.05,0.02,0.6,0.08,4,2,0.5,5,ANCHOR_SATELLITE,0.5,,,,,,PRUNED
591,-0.311943513174594,2026-05-14 10:31:57.952214,2026-05-14 10:31:58.547949,0 days 00:00:00.595735,0,CAP_LAYER,0.45,SAME,0.7,2,0.05,0.02,0.6,0.08,3,2,0.5,5,WIDE_V2,0.5,-0.03503602807514746,0.0022846139529225295,0.5538149701988931,0.03732064202806999,,COMPLETE
592,0.13344576510575448,2026-05-14 10:31:58.571711,2026-05-14 10:33:13.581318,0 days 00:01:15.009607,0,CAP_LAYER,0.45,SAME,0.7,2,0.05,0.02,0.6,0.16,3,2,0.5,5,WIDE_V2,0.8,,,,,,PRUNED
593,-9999.0,2026-05-14 10:33:13.607882,2026-05-14 10:33:14.020052,0 days 00:00:00.412170,0,NO_NET_ADD,0.45,SAME,0.7,2,0.05,0.01,0.6,0.08,3,2,0.7,5,ANCHOR_SATELLITE,0.5,,,,,BEAR_RATIO < NEUTRAL_RATIO < BULL_RATIO 约束违反: 0.45 / 0.7 / 0.7,COMPLETE
594,0.0659194981313123,2026-05-14 10:33:14.043842,2026-05-14 10:34:06.688591,0 days 00:00:52.644749,0,CAP_LAYER,0.45,ETF_DEFENSIVE,0.7,2,0.05,0.02,0.3,0.08,3,2,0.5,5,WIDE_V2,0.5,,,,,,PRUNED
595,0.21863458094319227,2026-05-14 10:34:06.713933,2026-05-14 10:35:28.508631,0 days 00:01:21.794698,1,CAP_LAYER,0.35,SAME,0.7,2,0.05,0.02,0.6,0.08,3,2,0.5,5,WIDE_V2,0.5,,,,,,PRUNED
596,-0.44349697075912387,2026-05-14 10:35:28.531217,2026-05-14 10:35:42.418337,0 days 00:00:13.887120,0,CAP_LAYER,0.45,SAME,0.7,2,0.05,0.01,0.45,0.08,8,2,0.5,5,ANCHOR_SATELLITE,0.5,,,,,,PRUNED
597,0.23756514311016674,2026-05-14 10:35:42.442147,2026-05-14 10:36:24.000138,0 days 00:00:41.557991,0,NO_NET_ADD,0.45,SAME,0.7,2,0.05,0.02,0.6,0.08,3,2,0.5,10,WIDE_V2,0.5,,,,,,PRUNED
598,-0.04585922261405112,2026-05-14 10:36:24.025297,2026-05-14 10:36:49.060002,0 days 00:00:25.034705,0,CAP_LAYER,0.45,SAME,0.7,2,0.05,0.02,0.6,0.16,3,2,0.5,20,WIDE_V2,0.5,,,,,,PRUNED
599,0.2219731821290077,2026-05-14 10:36:49.084746,2026-05-14 10:37:58.570902,0 days 00:01:09.486156,0,CAP_LAYER,0.45,SAME,0.9,2,0.05,0.02,0.6,0.08,3,2,0.7,5,WIDE_V2,0.5,,,,,,PRUNED
