number,value,datetime_start,datetime_complete,duration,params_BEAR_GRID_MAX_LAYER_CAP,params_BEAR_GRID_MODE,params_BEAR_RATIO,params_BEAR_UNIVERSE_MODE,params_BULL_RATIO,params_GRID_MAX_LAYER,params_GRID_STEP_MAX,params_GRID_STEP_MIN,params_GRID_STEP_VOL_FACTOR,params_LAYER_FRACTION,params_MAX_HOLD,params_MIN_ANCHORS_IN_POOL,params_NEUTRAL_RATIO,params_REBALANCE_FREQ,params_UNIVERSE_MODE,params_VOL_WEIGHT,user_attrs_avg_test_score,user_attrs_avg_train_score,user_attrs_test_score_std,user_attrs_train_test_gap,user_attrs_validation_error,state
0,-0.6410529359174669,2026-05-13 23:09:07.579634,2026-05-13 23:12:48.873210,0 days 00:03:41.293576,1,NORMAL,0.45,ETF_DEFENSIVE,0.8,2,0.05,0.01,0.3,0.16,8,2,0.5,10,WIDE_V2,0.65,-0.34991847116707514,-0.009322261448188254,0.5822689295007836,0.3405962097188869,,COMPLETE
1,-0.6745068674897018,2026-05-13 23:12:48.895495,2026-05-13 23:18:40.938077,0 days 00:05:52.042582,0,CAP_LAYER,0.25,SAME,0.7,4,0.05,0.01,0.6,0.12,5,2,0.6,5,WIDE_V2,0.65,-0.30878300054583446,0.01204384748082001,0.7314477338877347,0.32082684802665445,,COMPLETE
2,-0.7237813865536653,2026-05-13 23:18:40.963602,2026-05-13 23:19:07.401428,0 days 00:00:26.437826,1,NO_NET_ADD,0.35,ETF_DEFENSIVE,0.8,3,0.05,0.01,0.6,0.16,10,1,0.7,5,ANCHOR_SATELLITE,0.8,-0.6599811120397824,-0.22671376476242844,0.12760054902776582,0.43326734727735394,,COMPLETE
3,-0.6795332566328738,2026-05-13 23:19:07.426940,2026-05-13 23:20:01.843147,0 days 00:00:54.416207,1,NO_NET_ADD,0.25,SAME,0.8,4,0.03,0.02,0.6,0.12,8,1,0.6,20,WIDE_V2,0.65,-0.3679097723027734,-0.06326184470009397,0.6232469686602009,0.30464792760267945,,COMPLETE
4,-0.8101060196786055,2026-05-13 23:20:01.864436,2026-05-13 23:20:25.071602,0 days 00:00:23.207166,0,NORMAL,0.35,SAME,0.9,2,0.05,0.01,0.3,0.08,10,1,0.5,20,ANCHOR_SATELLITE,0.65,-0.7495779289560541,-0.25707511331959365,0.12105618144510281,0.4925028156364605,,COMPLETE
5,-9999.0,2026-05-13 23:20:25.097890,2026-05-13 23:20:25.451382,0 days 00:00:00.353492,1,CAP_LAYER,0.25,SAME,0.7,4,0.03,0.01,0.6,0.08,10,1,0.7,20,ANCHOR_SATELLITE,0.5,,,,,BEAR_RATIO < NEUTRAL_RATIO < BULL_RATIO 约束违反: 0.25 / 0.7 / 0.7,COMPLETE
6,-0.7971907421662383,2026-05-13 23:20:25.478480,2026-05-13 23:20:32.551106,0 days 00:00:07.072626,1,CAP_LAYER,0.35,ETF_DEFENSIVE,0.7,3,0.05,0.02,0.6,0.16,3,2,0.6,10,ANCHOR_SATELLITE,0.65,,,,,,PRUNED
7,-9999.0,2026-05-13 23:20:32.576981,2026-05-13 23:20:32.942794,0 days 00:00:00.365813,0,NO_NET_ADD,0.35,ETF_DEFENSIVE,0.7,2,0.03,0.01,0.45,0.16,10,2,0.7,5,ANCHOR_SATELLITE,0.65,,,,,BEAR_RATIO < NEUTRAL_RATIO < BULL_RATIO 约束违反: 0.35 / 0.7 / 0.7,COMPLETE
8,-0.5848926475578538,2026-05-13 23:20:32.969178,2026-05-13 23:21:13.673830,0 days 00:00:40.704652,1,NO_NET_ADD,0.35,SAME,0.7,2,0.03,0.01,0.45,0.08,8,2,0.6,20,WIDE_V2,0.65,-0.2502221157423696,-0.021090545633538207,0.6693410636309683,0.22913157010883137,,COMPLETE
9,-9999.0,2026-05-13 23:21:13.697197,2026-05-13 23:21:14.031876,0 days 00:00:00.334679,0,CAP_LAYER,0.45,ETF_DEFENSIVE,0.7,4,0.03,0.01,0.6,0.08,3,1,0.7,20,WIDE_V2,0.5,,,,,BEAR_RATIO < NEUTRAL_RATIO < BULL_RATIO 约束违反: 0.45 / 0.7 / 0.7,COMPLETE
10,-0.42075203402422134,2026-05-13 23:21:14.053836,2026-05-13 23:21:48.317079,0 days 00:00:34.263243,1,NO_NET_ADD,0.35,SAME,0.7,2,0.03,0.01,0.45,0.08,5,2,0.6,20,WIDE_V2,0.65,,,,,,PRUNED
11,-0.542261877807084,2026-05-13 23:21:48.341786,2026-05-13 23:23:31.029554,0 days 00:01:42.687768,1,NORMAL,0.45,ETF_DEFENSIVE,0.8,2,0.05,0.01,0.3,0.16,5,2,0.5,10,WIDE_V2,0.5,-0.20036434692310023,0.04304408173939121,0.6837950617679674,0.24340842866249146,,COMPLETE
12,-0.5549730962520887,2026-05-13 23:23:31.059288,2026-05-13 23:23:58.356145,0 days 00:00:27.296857,0,NORMAL,0.45,ETF_DEFENSIVE,0.8,2,0.05,0.02,0.3,0.16,5,2,0.5,20,WIDE_V2,0.5,-0.2717335582471815,0.07371248745209735,0.5664790760098143,0.34544604569927884,,COMPLETE
13,-0.4799897745105751,2026-05-13 23:23:58.380871,2026-05-13 23:24:07.788413,0 days 00:00:09.407542,0,NORMAL,0.45,ETF_DEFENSIVE,0.8,2,0.05,0.02,0.3,0.16,5,2,0.5,20,ANCHOR_SATELLITE,0.5,,,,,,PRUNED
14,-0.52501433949983,2026-05-13 23:24:07.812139,2026-05-13 23:24:49.974025,0 days 00:00:42.161886,1,NORMAL,0.45,ETF_DEFENSIVE,0.8,2,0.03,0.02,0.3,0.08,5,2,0.5,10,WIDE_V2,0.5,-0.18513599343072737,0.07548182048563772,0.6797566921382052,0.26061781391636507,,COMPLETE
15,-0.1809986210767214,2026-05-13 23:24:49.996639,2026-05-13 23:25:22.046768,0 days 00:00:32.050129,1,NORMAL,0.45,ETF_DEFENSIVE,0.8,4,0.03,0.02,0.3,0.08,3,2,0.5,10,WIDE_V2,0.5,,,,,,PRUNED
16,-0.5989864675463953,2026-05-13 23:25:22.071264,2026-05-13 23:26:02.121737,0 days 00:00:40.050473,1,NO_NET_ADD,0.25,ETF_DEFENSIVE,0.9,2,0.03,0.01,0.3,0.08,5,2,0.5,10,WIDE_V2,0.5,-0.2395494431201654,0.09420247312833539,0.7188740488524598,0.3337519162485008,,COMPLETE
17,-0.42234930198752973,2026-05-13 23:26:02.161233,2026-05-13 23:26:09.253970,0 days 00:00:07.092737,1,NORMAL,0.45,ETF_DEFENSIVE,0.7,3,0.05,0.01,0.3,0.08,5,2,0.5,10,ANCHOR_SATELLITE,0.5,,,,,,PRUNED
18,-0.5553428551227249,2026-05-13 23:26:09.278810,2026-05-13 23:26:53.930748,0 days 00:00:44.651938,1,CAP_LAYER,0.45,ETF_DEFENSIVE,0.8,3,0.05,0.01,0.3,0.16,5,1,0.5,10,WIDE_V2,0.5,-0.2074390827366291,0.015545062076129641,0.6958075447721916,0.22298414481275872,,COMPLETE
19,-0.546441785494363,2026-05-13 23:26:53.953868,2026-05-13 23:27:33.643977,0 days 00:00:39.690109,1,NORMAL,0.45,ETF_DEFENSIVE,0.8,2,0.03,0.01,0.45,0.12,5,1,0.5,10,WIDE_V2,0.5,-0.20074698656185389,0.050367817201087114,0.6913895978650181,0.251114803762941,,COMPLETE
20,-0.27057171582757866,2026-05-13 23:27:33.666441,2026-05-13 23:28:08.533318,0 days 00:00:34.866877,1,NORMAL,0.45,ETF_DEFENSIVE,0.8,2,0.03,0.02,0.3,0.16,5,2,0.5,10,WIDE_V2,0.8,,,,,,PRUNED
21,-0.546441785494363,2026-05-13 23:28:08.556318,2026-05-13 23:28:09.116730,0 days 00:00:00.560412,1,NORMAL,0.45,ETF_DEFENSIVE,0.8,2,0.03,0.01,0.45,0.12,5,1,0.5,10,WIDE_V2,0.5,-0.20074698656185389,0.050367817201087114,0.6913895978650181,0.251114803762941,,COMPLETE
22,-0.5341084976221846,2026-05-13 23:28:09.144783,2026-05-13 23:30:39.347931,0 days 00:02:30.203148,1,NORMAL,0.45,SAME,0.8,2,0.05,0.01,0.3,0.16,5,2,0.7,10,WIDE_V2,0.5,-0.1338046042947265,0.10364640822743006,0.8006077866549162,0.23745101252215656,,COMPLETE
23,-9999.0,2026-05-13 23:30:39.370172,2026-05-13 23:30:39.708802,0 days 00:00:00.338630,1,NORMAL,0.25,SAME,0.7,2,0.05,0.01,0.3,0.16,4,2,0.7,10,WIDE_V2,0.5,,,,,BEAR_RATIO < NEUTRAL_RATIO < BULL_RATIO 约束违反: 0.25 / 0.7 / 0.7,COMPLETE
24,-0.5775971900612626,2026-05-13 23:30:39.732355,2026-05-13 23:35:25.852595,0 days 00:04:46.120240,1,NORMAL,0.45,SAME,0.8,4,0.05,0.01,0.3,0.16,5,2,0.7,5,WIDE_V2,0.5,-0.20394311901094894,-0.027744427753357344,0.7473081421006275,0.1761986912575916,,COMPLETE
25,-0.06680980271030457,2026-05-13 23:35:25.873637,2026-05-13 23:35:55.523769,0 days 00:00:29.650132,1,NORMAL,0.35,SAME,0.8,2,0.05,0.01,0.3,0.16,3,2,0.5,20,WIDE_V2,0.5,,,,,,PRUNED
26,-0.47731404382997694,2026-05-13 23:35:55.545422,2026-05-13 23:38:07.095140,0 days 00:02:11.549718,1,NORMAL,0.45,SAME,0.8,2,0.03,0.01,0.3,0.08,5,2,0.5,5,WIDE_V2,0.5,-0.11857543771352279,0.05850678261875053,0.7174772122329083,0.17708222033227333,,COMPLETE
27,0.08776131309760257,2026-05-13 23:38:07.118481,2026-05-13 23:39:03.145297,0 days 00:00:56.026816,1,NO_NET_ADD,0.45,ETF_DEFENSIVE,0.7,2,0.03,0.02,0.3,0.08,5,2,0.6,5,WIDE_V2,0.5,,,,,,PRUNED
28,0.06869059376704631,2026-05-13 23:39:03.172073,2026-05-13 23:40:35.389167,0 days 00:01:32.217094,0,NORMAL,0.35,SAME,0.8,2,0.03,0.01,0.3,0.08,10,2,0.5,5,WIDE_V2,0.5,,,,,,PRUNED
29,-0.5556201698810451,2026-05-13 23:40:35.415337,2026-05-13 23:40:55.783489,0 days 00:00:20.368152,1,NORMAL,0.45,SAME,0.8,2,0.03,0.01,0.3,0.08,8,2,0.5,20,ANCHOR_SATELLITE,0.5,,,,,,PRUNED
30,-0.6214255185902038,2026-05-13 23:40:55.809206,2026-05-13 23:44:45.866199,0 days 00:03:50.056993,1,NORMAL,0.45,SAME,0.8,2,0.03,0.01,0.45,0.08,5,2,0.5,5,WIDE_V2,0.8,-0.2088938091214884,0.07653051008184622,0.8250634189374307,0.2854243192033346,,COMPLETE
31,-0.5339878179589292,2026-05-13 23:44:45.893737,2026-05-13 23:46:11.991598,0 days 00:01:26.097861,1,NORMAL,0.45,SAME,0.8,2,0.05,0.02,0.45,0.16,5,2,0.7,10,WIDE_V2,0.5,-0.13372660948833257,0.10364100790594903,0.8005224169411933,0.23736761739428158,,COMPLETE
32,-0.5433046098532035,2026-05-13 23:46:12.017665,2026-05-13 23:47:24.098456,0 days 00:01:12.080791,1,NORMAL,0.45,SAME,0.9,2,0.05,0.02,0.45,0.16,5,2,0.7,10,WIDE_V2,0.5,-0.1319098505898701,0.11464330408994096,0.8227895185266668,0.24655315467981104,,COMPLETE
33,-0.5371430349530388,2026-05-13 23:47:24.122544,2026-05-13 23:48:33.313533,0 days 00:01:09.190989,1,NORMAL,0.45,SAME,0.8,2,0.03,0.01,0.3,0.12,5,2,0.7,10,WIDE_V2,0.5,-0.13957969264357575,0.10681357219562652,0.7951266846189261,0.24639326483920226,,COMPLETE
34,-0.45756154033646224,2026-05-13 23:48:33.338421,2026-05-13 23:50:47.586424,0 days 00:02:14.248003,1,CAP_LAYER,0.45,SAME,0.7,2,0.03,0.01,0.3,0.08,5,2,0.5,5,WIDE_V2,0.5,-0.10062055895350795,0.06077579629534386,0.7138819627659085,0.16139635524885182,,COMPLETE
35,0.11201822032690742,2026-05-13 23:50:47.610340,2026-05-13 23:52:14.542147,0 days 00:01:26.931807,1,NO_NET_ADD,0.45,SAME,0.7,2,0.05,0.01,0.3,0.08,5,2,0.5,5,WIDE_V2,0.65,,,,,,PRUNED
36,-0.34292046180355085,2026-05-13 23:52:14.567803,2026-05-13 23:54:34.177101,0 days 00:02:19.609298,1,CAP_LAYER,0.45,SAME,0.7,2,0.03,0.01,0.3,0.16,3,2,0.5,5,WIDE_V2,0.5,-0.07580467428504908,-0.04360953505856683,0.5342315750370036,0.032195139226482254,,COMPLETE
37,-0.45380887175716494,2026-05-13 23:54:34.198600,2026-05-13 23:56:47.361438,0 days 00:02:13.162838,0,CAP_LAYER,0.45,SAME,0.7,2,0.03,0.01,0.3,0.08,5,2,0.5,5,WIDE_V2,0.5,-0.09043541636360304,0.06726862257461694,0.7267469107871238,0.15770403893822,,COMPLETE
38,-9999.0,2026-05-13 23:56:47.386481,2026-05-13 23:56:47.767862,0 days 00:00:00.381381,0,CAP_LAYER,0.45,SAME,0.7,2,0.03,0.01,0.3,0.08,5,2,0.7,5,ANCHOR_SATELLITE,0.5,,,,,BEAR_RATIO < NEUTRAL_RATIO < BULL_RATIO 约束违反: 0.45 / 0.7 / 0.7,COMPLETE
39,-0.33208002362227534,2026-05-13 23:56:47.792535,2026-05-13 23:59:02.771296,0 days 00:02:14.978761,1,CAP_LAYER,0.45,SAME,0.7,2,0.03,0.01,0.3,0.12,3,2,0.5,5,WIDE_V2,0.5,-0.06307100427019345,-0.026433502097220795,0.5380180387041638,0.03663750217297265,,COMPLETE
40,-0.3670532374552245,2026-05-13 23:59:02.798663,2026-05-14 00:01:14.373705,0 days 00:02:11.575042,1,CAP_LAYER,0.45,SAME,0.7,2,0.03,0.01,0.3,0.12,3,2,0.6,5,WIDE_V2,0.5,-0.0824633846655028,-0.01389123393446197,0.5691797055794434,0.06857215073104084,,COMPLETE
41,-0.33208002362227534,2026-05-14 00:01:14.399060,2026-05-14 00:01:15.001715,0 days 00:00:00.602655,1,CAP_LAYER,0.45,SAME,0.7,2,0.03,0.01,0.3,0.12,3,2,0.5,5,WIDE_V2,0.5,-0.06307100427019345,-0.026433502097220795,0.5380180387041638,0.03663750217297265,,COMPLETE
42,0.14074274473394974,2026-05-14 00:01:15.026230,2026-05-14 00:02:35.791645,0 days 00:01:20.765415,1,CAP_LAYER,0.45,SAME,0.7,2,0.03,0.01,0.3,0.12,3,2,0.6,5,WIDE_V2,0.8,,,,,,PRUNED
43,-0.31605091683366315,2026-05-14 00:02:35.814756,2026-05-14 00:04:46.587266,0 days 00:02:10.772510,0,CAP_LAYER,0.45,SAME,0.7,2,0.03,0.01,0.6,0.12,3,2,0.5,5,WIDE_V2,0.5,-0.04781335681448906,-0.017993193791458337,0.5364751200383482,0.029820163023030723,,COMPLETE
44,0.16602665744332995,2026-05-14 00:04:46.612702,2026-05-14 00:06:26.532122,0 days 00:01:39.919420,1,CAP_LAYER,0.45,SAME,0.9,3,0.03,0.01,0.3,0.12,3,2,0.5,5,WIDE_V2,0.5,,,,,,PRUNED
45,-0.3364910647092562,2026-05-14 00:06:26.559898,2026-05-14 00:08:39.228493,0 days 00:02:12.668595,0,CAP_LAYER,0.45,SAME,0.7,4,0.03,0.01,0.6,0.12,3,2,0.5,5,WIDE_V2,0.5,-0.07923544236911266,-0.058894328369012226,0.5145112446802871,0.020341114000100434,,COMPLETE
46,0.1506254059661285,2026-05-14 00:08:39.254829,2026-05-14 00:09:18.619245,0 days 00:00:39.364416,0,CAP_LAYER,0.45,SAME,0.7,2,0.03,0.01,0.45,0.12,3,2,0.5,10,WIDE_V2,0.5,,,,,,PRUNED
47,-0.3679209438865948,2026-05-14 00:09:18.646448,2026-05-14 00:09:30.087694,0 days 00:00:11.441246,0,CAP_LAYER,0.45,SAME,0.7,4,0.03,0.01,0.6,0.08,3,2,0.5,5,ANCHOR_SATELLITE,0.5,,,,,,PRUNED
48,0.1620645546108947,2026-05-14 00:09:30.110325,2026-05-14 00:10:45.393827,0 days 00:01:15.283502,1,CAP_LAYER,0.35,SAME,0.7,2,0.03,0.01,0.6,0.16,3,2,0.5,5,WIDE_V2,0.5,,,,,,PRUNED
49,0.17522091930763067,2026-05-14 00:10:45.417456,2026-05-14 00:11:59.930268,0 days 00:01:14.512812,0,CAP_LAYER,0.45,SAME,0.8,4,0.03,0.01,0.6,0.12,3,2,0.5,5,WIDE_V2,0.5,,,,,,PRUNED
50,0.13202072967087108,2026-05-14 00:11:59.956120,2026-05-14 00:13:21.373552,0 days 00:01:21.417432,0,CAP_LAYER,0.45,SAME,0.7,3,0.03,0.01,0.6,0.12,3,2,0.5,5,WIDE_V2,0.8,,,,,,PRUNED
51,-0.31605091683366315,2026-05-14 00:13:21.397465,2026-05-14 00:15:32.468880,0 days 00:02:11.071415,0,CAP_LAYER,0.45,SAME,0.7,2,0.03,0.01,0.6,0.12,3,1,0.5,5,WIDE_V2,0.5,-0.04781335681448906,-0.017993193791458337,0.5364751200383482,0.029820163023030723,,COMPLETE
52,-0.31605091683366315,2026-05-14 00:15:32.493177,2026-05-14 00:15:33.079948,0 days 00:00:00.586771,0,CAP_LAYER,0.45,SAME,0.7,2,0.03,0.01,0.6,0.12,3,1,0.5,5,WIDE_V2,0.5,-0.04781335681448906,-0.017993193791458337,0.5364751200383482,0.029820163023030723,,COMPLETE
53,-0.4022358980258101,2026-05-14 00:15:33.105214,2026-05-14 00:17:54.171031,0 days 00:02:21.065817,0,NORMAL,0.45,SAME,0.7,2,0.03,0.01,0.6,0.12,4,1,0.5,5,WIDE_V2,0.5,-0.06595935355920902,0.11743447521957426,0.6725530889332022,0.1833938287787833,,COMPLETE
54,-0.15812859222888392,2026-05-14 00:17:54.199530,2026-05-14 00:18:25.164006,0 days 00:00:30.964476,0,CAP_LAYER,0.45,ETF_DEFENSIVE,0.7,2,0.03,0.01,0.6,0.12,3,1,0.5,10,WIDE_V2,0.65,,,,,,PRUNED
55,-0.4715097098061242,2026-05-14 00:18:25.190360,2026-05-14 00:19:54.370818,0 days 00:01:29.180458,0,CAP_LAYER,0.45,SAME,0.7,2,0.03,0.01,0.6,0.16,6,1,0.5,10,WIDE_V2,0.5,-0.08231424964874856,0.05590530325825173,0.7783909203147513,0.13821955290700028,,COMPLETE
56,-0.3613101416445892,2026-05-14 00:19:54.393714,2026-05-14 00:20:05.930754,0 days 00:00:11.537040,0,CAP_LAYER,0.45,SAME,0.7,2,0.05,0.01,0.6,0.12,3,1,0.5,5,ANCHOR_SATELLITE,0.5,,,,,,PRUNED
57,0.16114439090260452,2026-05-14 00:20:05.958058,2026-05-14 00:23:16.738357,0 days 00:03:10.780299,0,CAP_LAYER,0.25,SAME,0.7,2,0.03,0.01,0.6,0.12,3,1,0.6,5,WIDE_V2,0.5,,,,,,PRUNED
58,-0.31605091683366315,2026-05-14 00:23:16.762999,2026-05-14 00:26:01.465357,0 days 00:02:44.702358,0,CAP_LAYER,0.45,SAME,0.7,2,0.03,0.01,0.3,0.12,3,1,0.5,5,WIDE_V2,0.5,-0.04781335681448906,-0.017993193791458337,0.5364751200383482,0.029820163023030723,,COMPLETE
59,-0.31605091683366315,2026-05-14 00:26:01.487687,2026-05-14 00:26:02.074452,0 days 00:00:00.586765,0,CAP_LAYER,0.45,SAME,0.7,2,0.03,0.01,0.3,0.12,3,1,0.5,5,WIDE_V2,0.5,-0.04781335681448906,-0.017993193791458337,0.5364751200383482,0.029820163023030723,,COMPLETE
60,-0.03058283629232919,2026-05-14 00:26:02.096387,2026-05-14 00:26:26.395188,0 days 00:00:24.298801,0,CAP_LAYER,0.45,SAME,0.9,2,0.03,0.02,0.3,0.12,3,1,0.5,20,WIDE_V2,0.5,,,,,,PRUNED
61,0.060319383577131354,2026-05-14 00:26:26.417744,2026-05-14 00:27:23.364613,0 days 00:00:56.946869,0,CAP_LAYER,0.45,ETF_DEFENSIVE,0.7,2,0.03,0.01,0.45,0.08,3,1,0.5,5,WIDE_V2,0.5,,,,,,PRUNED
62,0.12497523569822447,2026-05-14 00:27:23.391636,2026-05-14 00:28:58.498389,0 days 00:01:35.106753,0,CAP_LAYER,0.45,SAME,0.7,2,0.03,0.01,0.3,0.12,10,1,0.5,5,WIDE_V2,0.65,,,,,,PRUNED
63,0.17788752372415348,2026-05-14 00:28:58.521717,2026-05-14 00:30:13.688064,0 days 00:01:15.166347,0,CAP_LAYER,0.45,SAME,0.7,4,0.03,0.02,0.3,0.12,3,1,0.6,5,WIDE_V2,0.5,,,,,,PRUNED
64,-9999.0,2026-05-14 00:30:13.711756,2026-05-14 00:30:14.099376,0 days 00:00:00.387620,0,NO_NET_ADD,0.45,SAME,0.7,2,0.03,0.01,0.3,0.12,5,1,0.7,5,WIDE_V2,0.5,,,,,BEAR_RATIO < NEUTRAL_RATIO < BULL_RATIO 约束违反: 0.45 / 0.7 / 0.7,COMPLETE
65,-0.31605091683366315,2026-05-14 00:30:14.124828,2026-05-14 00:32:30.888194,0 days 00:02:16.763366,0,CAP_LAYER,0.45,SAME,0.7,2,0.03,0.02,0.6,0.12,3,1,0.5,5,WIDE_V2,0.5,-0.04781335681448906,-0.017993193791458337,0.5364751200383482,0.029820163023030723,,COMPLETE
66,-0.42831131900780317,2026-05-14 00:32:30.912321,2026-05-14 00:34:44.564277,0 days 00:02:13.651956,0,NO_NET_ADD,0.45,SAME,0.7,2,0.03,0.02,0.6,0.12,3,1,0.5,5,WIDE_V2,0.65,-0.08848618389406028,0.012581026350592907,0.6796502702274858,0.10106721024465319,,COMPLETE
67,-0.31605091683366315,2026-05-14 00:34:44.586520,2026-05-14 00:34:45.056447,0 days 00:00:00.469927,0,CAP_LAYER,0.45,SAME,0.7,2,0.03,0.01,0.6,0.12,3,1,0.5,5,WIDE_V2,0.5,-0.04781335681448906,-0.017993193791458337,0.5364751200383482,0.029820163023030723,,COMPLETE
68,-0.45451335012938543,2026-05-14 00:34:45.076295,2026-05-14 00:37:15.177516,0 days 00:02:30.101221,1,CAP_LAYER,0.45,SAME,0.7,2,0.03,0.02,0.6,0.12,5,1,0.5,5,WIDE_V2,0.5,-0.09442418055358116,0.03720437922114604,0.7201783391516086,0.1316285597747272,,COMPLETE
69,0.0011975743607967396,2026-05-14 00:37:15.202146,2026-05-14 00:38:10.200585,0 days 00:00:54.998439,0,CAP_LAYER,0.35,ETF_DEFENSIVE,0.7,2,0.03,0.02,0.3,0.12,3,1,0.5,5,WIDE_V2,0.5,,,,,,PRUNED
70,0.15677363496302815,2026-05-14 00:38:10.227295,2026-05-14 00:39:26.651373,0 days 00:01:16.424078,0,CAP_LAYER,0.25,SAME,0.7,2,0.03,0.02,0.6,0.16,3,1,0.5,5,WIDE_V2,0.5,,,,,,PRUNED
71,-0.006249507618309537,2026-05-14 00:39:26.674573,2026-05-14 00:40:19.128340,0 days 00:00:52.453767,0,NO_NET_ADD,0.35,ETF_DEFENSIVE,0.7,2,0.03,0.01,0.6,0.12,3,2,0.5,5,WIDE_V2,0.5,,,,,,PRUNED
72,-0.31605091683366315,2026-05-14 00:40:19.152271,2026-05-14 00:40:19.757353,0 days 00:00:00.605082,0,CAP_LAYER,0.45,SAME,0.7,2,0.03,0.01,0.3,0.12,3,1,0.5,5,WIDE_V2,0.5,-0.04781335681448906,-0.017993193791458337,0.5364751200383482,0.029820163023030723,,COMPLETE
73,0.20506801188399862,2026-05-14 00:40:19.781881,2026-05-14 00:41:35.583044,0 days 00:01:15.801163,0,NO_NET_ADD,0.45,SAME,0.7,4,0.05,0.01,0.3,0.12,3,1,0.5,5,WIDE_V2,0.5,,,,,,PRUNED
74,-0.03169413910195332,2026-05-14 00:41:35.607051,2026-05-14 00:41:59.772992,0 days 00:00:24.165941,0,CAP_LAYER,0.45,SAME,0.7,2,0.03,0.01,0.6,0.12,3,1,0.5,20,WIDE_V2,0.5,,,,,,PRUNED
75,0.19761153669716314,2026-05-14 00:41:59.797592,2026-05-14 00:43:16.414063,0 days 00:01:16.616471,0,CAP_LAYER,0.35,SAME,0.8,2,0.03,0.01,0.3,0.12,3,1,0.5,5,WIDE_V2,0.5,,,,,,PRUNED
76,0.20719633298727433,2026-05-14 00:43:16.436585,2026-05-14 00:44:36.363119,0 days 00:01:19.926534,0,CAP_LAYER,0.45,SAME,0.7,3,0.03,0.01,0.3,0.12,3,1,0.5,5,WIDE_V2,0.5,,,,,,PRUNED
77,-0.43817106899904773,2026-05-14 00:44:36.389978,2026-05-14 00:44:45.329343,0 days 00:00:08.939365,0,CAP_LAYER,0.45,SAME,0.7,2,0.03,0.01,0.3,0.12,3,1,0.5,10,ANCHOR_SATELLITE,0.5,,,,,,PRUNED
78,-9999.0,2026-05-14 00:44:45.353113,2026-05-14 00:44:45.735177,0 days 00:00:00.382064,0,CAP_LAYER,0.45,SAME,0.7,2,0.05,0.02,0.6,0.12,8,1,0.7,5,WIDE_V2,0.5,,,,,BEAR_RATIO < NEUTRAL_RATIO < BULL_RATIO 约束违反: 0.45 / 0.7 / 0.7,COMPLETE
79,-0.5436071161143593,2026-05-14 00:44:45.758316,2026-05-14 00:47:11.375708,0 days 00:02:25.617392,0,CAP_LAYER,0.35,SAME,0.7,2,0.05,0.01,0.6,0.12,6,2,0.5,5,WIDE_V2,0.5,-0.15343412662203873,0.03683973363310422,0.7803459789846411,0.19027386025514295,,COMPLETE
80,0.14061921736808508,2026-05-14 00:47:11.401640,2026-05-14 00:48:28.007875,0 days 00:01:16.606235,0,NORMAL,0.25,SAME,0.7,2,0.03,0.01,0.3,0.12,3,1,0.5,5,WIDE_V2,0.5,,,,,,PRUNED
81,0.19509387615704055,2026-05-14 00:48:28.032739,2026-05-14 00:49:47.398215,0 days 00:01:19.365476,0,CAP_LAYER,0.45,SAME,0.9,2,0.03,0.01,0.3,0.16,3,1,0.5,5,WIDE_V2,0.5,,,,,,PRUNED
82,-9999.0,2026-05-14 00:49:47.423715,2026-05-14 00:49:47.807673,0 days 00:00:00.383958,0,CAP_LAYER,0.45,SAME,0.7,2,0.03,0.01,0.3,0.12,3,1,0.7,5,WIDE_V2,0.5,,,,,BEAR_RATIO < NEUTRAL_RATIO < BULL_RATIO 约束违反: 0.45 / 0.7 / 0.7,COMPLETE
83,0.2216963336242472,2026-05-14 00:49:47.831710,2026-05-14 00:51:03.730510,0 days 00:01:15.898800,0,CAP_LAYER,0.45,SAME,0.8,2,0.03,0.02,0.6,0.12,3,1,0.5,5,WIDE_V2,0.5,,,,,,PRUNED
84,-0.4667588834884514,2026-05-14 00:51:03.757852,2026-05-14 00:51:19.927338,0 days 00:00:16.169486,0,CAP_LAYER,0.45,SAME,0.7,2,0.03,0.02,0.6,0.12,8,1,0.5,5,ANCHOR_SATELLITE,0.5,,,,,,PRUNED
85,0.13888864584432534,2026-05-14 00:51:19.952091,2026-05-14 00:52:45.663035,0 days 00:01:25.710944,0,CAP_LAYER,0.45,SAME,0.7,2,0.03,0.01,0.6,0.12,5,1,0.5,5,WIDE_V2,0.8,,,,,,PRUNED
86,-0.5937721409005412,2026-05-14 00:52:45.690042,2026-05-14 00:55:04.969454,0 days 00:02:19.279412,0,NO_NET_ADD,0.45,SAME,0.9,2,0.03,0.01,0.6,0.12,6,1,0.5,5,WIDE_V2,0.5,-0.2204650149746925,0.02484212676453536,0.7466142518516975,0.24530714173922788,,COMPLETE
87,-9999.0,2026-05-14 00:55:04.995327,2026-05-14 00:55:05.373004,0 days 00:00:00.377677,0,CAP_LAYER,0.45,ETF_DEFENSIVE,0.7,2,0.03,0.01,0.6,0.16,3,1,0.7,5,WIDE_V2,0.5,,,,,BEAR_RATIO < NEUTRAL_RATIO < BULL_RATIO 约束违反: 0.45 / 0.7 / 0.7,COMPLETE
88,0.11748188241755488,2026-05-14 00:55:05.399100,2026-05-14 00:56:24.560925,0 days 00:01:19.161825,1,NO_NET_ADD,0.45,SAME,0.7,3,0.03,0.01,0.6,0.12,3,1,0.5,5,WIDE_V2,0.5,,,,,,PRUNED
89,0.1792098955805274,2026-05-14 00:56:24.586641,2026-05-14 00:57:39.596719,0 days 00:01:15.010078,0,NO_NET_ADD,0.45,SAME,0.7,2,0.03,0.01,0.45,0.12,3,1,0.5,5,WIDE_V2,0.5,,,,,,PRUNED
90,0.1441994199199963,2026-05-14 00:57:39.622411,2026-05-14 00:58:56.283671,0 days 00:01:16.661260,0,NO_NET_ADD,0.45,SAME,0.7,2,0.03,0.01,0.6,0.16,3,2,0.5,5,WIDE_V2,0.5,,,,,,PRUNED
91,0.1433211901973205,2026-05-14 00:58:56.311752,2026-05-14 01:00:31.257163,0 days 00:01:34.945411,0,CAP_LAYER,0.45,SAME,0.7,2,0.03,0.01,0.6,0.08,10,1,0.5,5,WIDE_V2,0.5,,,,,,PRUNED
