number,value,datetime_start,datetime_complete,duration,params_BEAR_GRID_MAX_LAYER_CAP,params_BEAR_GRID_MODE,params_BEAR_RATIO,params_BEAR_UNIVERSE_MODE,params_BULL_RATIO,params_GRID_MAX_LAYER,params_GRID_STEP_MAX,params_GRID_STEP_MIN,params_GRID_STEP_VOL_FACTOR,params_LAYER_FRACTION,params_MAX_HOLD,params_MIN_ANCHORS_IN_POOL,params_NEUTRAL_RATIO,params_REBALANCE_FREQ,params_UNIVERSE_MODE,params_VOL_WEIGHT,user_attrs_avg_test_score,user_attrs_avg_train_score,user_attrs_test_score_std,user_attrs_train_test_gap,user_attrs_validation_error,state
389,-0.4349734231443414,2026-05-14 06:25:49.022489,2026-05-14 06:29:47.715772,0 days 00:03:58.693283,0,NO_NET_ADD,0.45,SAME,0.7,2,0.05,0.02,0.6,0.08,4,2,0.5,5,WIDE_V2,0.5,-0.08582980673022643,0.12597310778106974,0.6982872328282299,0.21180291451129618,,COMPLETE
390,0.10398442452913464,2026-05-14 06:29:47.740958,2026-05-14 06:30:29.095347,0 days 00:00:41.354389,0,CAP_LAYER,0.45,SAME,0.7,2,0.05,0.02,0.6,0.16,10,2,0.5,20,WIDE_V2,0.5,,,,,,PRUNED
391,0.22697331605230964,2026-05-14 06:30:29.126907,2026-05-14 06:31:48.421880,0 days 00:01:19.294973,1,CAP_LAYER,0.45,SAME,0.9,2,0.05,0.02,0.3,0.08,3,2,0.5,5,WIDE_V2,0.5,,,,,,PRUNED
392,0.23637162659597621,2026-05-14 06:31:48.448528,2026-05-14 06:33:03.183564,0 days 00:01:14.735036,1,CAP_LAYER,0.45,SAME,0.8,2,0.05,0.02,0.6,0.08,3,2,0.5,5,WIDE_V2,0.5,,,,,,PRUNED
393,-0.5961191184496978,2026-05-14 06:33:03.209829,2026-05-14 06:35:32.413710,0 days 00:02:29.203881,0,NO_NET_ADD,0.25,SAME,0.7,2,0.05,0.02,0.6,0.08,5,2,0.5,5,WIDE_V2,0.5,-0.2220723212956654,0.025713621096095058,0.7480935943080648,0.24778594239176047,,COMPLETE
394,0.23301221659087937,2026-05-14 06:35:32.441119,2026-05-14 06:36:49.441014,0 days 00:01:16.999895,0,CAP_LAYER,0.35,SAME,0.7,2,0.05,0.02,0.6,0.08,3,1,0.5,5,WIDE_V2,0.5,,,,,,PRUNED
395,0.017726249168612332,2026-05-14 06:36:49.466867,2026-05-14 06:37:45.600398,0 days 00:00:56.133531,0,CAP_LAYER,0.45,ETF_DEFENSIVE,0.7,2,0.03,0.02,0.6,0.16,3,2,0.5,5,WIDE_V2,0.5,,,,,,PRUNED
396,0.24929021699652526,2026-05-14 06:37:45.623967,2026-05-14 06:39:00.274933,0 days 00:01:14.650966,0,CAP_LAYER,0.45,SAME,0.7,3,0.05,0.02,0.3,0.08,3,2,0.6,5,WIDE_V2,0.5,,,,,,PRUNED
397,0.23301221659087937,2026-05-14 06:39:00.298490,2026-05-14 06:40:16.219624,0 days 00:01:15.921134,0,CAP_LAYER,0.35,SAME,0.7,2,0.05,0.01,0.6,0.08,3,2,0.5,5,WIDE_V2,0.5,,,,,,PRUNED
398,0.2480339546150649,2026-05-14 06:40:16.243441,2026-05-14 06:41:30.717005,0 days 00:01:14.473564,0,CAP_LAYER,0.45,SAME,0.7,4,0.05,0.01,0.6,0.08,3,2,0.5,5,WIDE_V2,0.5,,,,,,PRUNED
399,0.22366282151818728,2026-05-14 06:41:30.743061,2026-05-14 06:42:53.125520,0 days 00:01:22.382459,0,CAP_LAYER,0.45,SAME,0.9,3,0.05,0.02,0.3,0.08,3,2,0.5,5,WIDE_V2,0.5,,,,,,PRUNED
400,0.11911928302962041,2026-05-14 06:42:53.150142,2026-05-14 06:44:22.978417,0 days 00:01:29.828275,0,NORMAL,0.45,SAME,0.7,2,0.05,0.02,0.45,0.08,10,1,0.5,5,WIDE_V2,0.5,,,,,,PRUNED
401,0.17770651604119525,2026-05-14 06:44:23.004787,2026-05-14 06:45:37.562776,0 days 00:01:14.557989,0,CAP_LAYER,0.25,SAME,0.7,2,0.05,0.02,0.6,0.12,3,2,0.5,5,WIDE_V2,0.5,,,,,,PRUNED
402,-9999.0,2026-05-14 06:45:37.586697,2026-05-14 06:45:37.977603,0 days 00:00:00.390906,0,CAP_LAYER,0.45,SAME,0.7,3,0.05,0.02,0.6,0.08,3,2,0.7,5,WIDE_V2,0.5,,,,,BEAR_RATIO < NEUTRAL_RATIO < BULL_RATIO 约束违反: 0.45 / 0.7 / 0.7,COMPLETE
403,-0.45146440705031016,2026-05-14 06:45:38.003117,2026-05-14 06:47:52.603135,0 days 00:02:14.600018,0,CAP_LAYER,0.45,SAME,0.7,2,0.05,0.02,0.6,0.08,5,1,0.5,5,WIDE_V2,0.5,-0.08617059133899664,0.07241381636944513,0.7305876314226271,0.1585844077084418,,COMPLETE
404,-0.45380887175716494,2026-05-14 06:47:52.628495,2026-05-14 06:50:11.181140,0 days 00:02:18.552645,0,CAP_LAYER,0.45,SAME,0.7,2,0.03,0.02,0.6,0.08,5,2,0.5,5,WIDE_V2,0.5,-0.09043541636360304,0.06726862257461694,0.7267469107871238,0.15770403893822,,COMPLETE
405,0.243571435401933,2026-05-14 06:50:11.209623,2026-05-14 06:51:28.547205,0 days 00:01:17.337582,0,CAP_LAYER,0.45,SAME,0.8,2,0.05,0.01,0.6,0.08,3,2,0.5,5,WIDE_V2,0.5,,,,,,PRUNED
406,-0.021532909315092164,2026-05-14 06:51:28.570694,2026-05-14 06:51:51.897024,0 days 00:00:23.326330,0,CAP_LAYER,0.45,SAME,0.8,2,0.05,0.02,0.6,0.08,3,2,0.6,20,WIDE_V2,0.5,,,,,,PRUNED
407,-0.014537143847364514,2026-05-14 06:51:51.922273,2026-05-14 06:52:15.353653,0 days 00:00:23.431380,0,CAP_LAYER,0.35,SAME,0.7,2,0.05,0.02,0.6,0.08,3,2,0.5,20,WIDE_V2,0.5,,,,,,PRUNED
408,-0.4085131538160618,2026-05-14 06:52:15.474358,2026-05-14 06:54:32.611219,0 days 00:02:17.136861,0,NO_NET_ADD,0.45,SAME,0.7,2,0.05,0.02,0.3,0.08,3,2,0.5,5,WIDE_V2,0.65,-0.0670033707070102,0.03618060222819482,0.6830195662181031,0.10318397293520504,,COMPLETE
409,-0.433789709235171,2026-05-14 06:54:32.635215,2026-05-14 06:54:41.876103,0 days 00:00:09.240888,0,CAP_LAYER,0.45,SAME,0.7,2,0.05,0.02,0.6,0.08,3,2,0.5,10,ANCHOR_SATELLITE,0.5,,,,,,PRUNED
410,0.17640449899742852,2026-05-14 06:54:41.901405,2026-05-14 06:56:05.426788,0 days 00:01:23.525383,0,NO_NET_ADD,0.45,SAME,0.7,2,0.05,0.02,0.6,0.08,3,2,0.5,5,WIDE_V2,0.8,,,,,,PRUNED
411,0.1755048017876987,2026-05-14 06:56:05.454155,2026-05-14 06:56:46.551225,0 days 00:00:41.097070,1,CAP_LAYER,0.45,SAME,0.7,2,0.05,0.02,0.6,0.08,3,2,0.5,10,WIDE_V2,0.5,,,,,,PRUNED
412,-0.5537975381466925,2026-05-14 06:56:46.576718,2026-05-14 06:56:51.800076,0 days 00:00:05.223358,1,CAP_LAYER,0.25,SAME,0.7,2,0.05,0.02,0.6,0.08,3,2,0.6,5,ANCHOR_SATELLITE,0.5,,,,,,PRUNED
413,0.25099239456903844,2026-05-14 06:56:51.824492,2026-05-14 06:58:08.933013,0 days 00:01:17.108521,1,NORMAL,0.45,SAME,0.7,2,0.05,0.02,0.6,0.08,3,2,0.5,5,WIDE_V2,0.5,,,,,,PRUNED
414,-9999.0,2026-05-14 06:58:08.960490,2026-05-14 06:58:09.321198,0 days 00:00:00.360708,0,CAP_LAYER,0.45,SAME,0.7,4,0.05,0.02,0.6,0.08,3,2,0.7,5,WIDE_V2,0.5,,,,,BEAR_RATIO < NEUTRAL_RATIO < BULL_RATIO 约束违反: 0.45 / 0.7 / 0.7,COMPLETE
415,0.20015935327542334,2026-05-14 06:58:09.347139,2026-05-14 06:59:23.891447,0 days 00:01:14.544308,0,NORMAL,0.45,SAME,0.7,2,0.05,0.02,0.6,0.16,3,2,0.6,5,WIDE_V2,0.5,,,,,,PRUNED
416,0.2480339546150649,2026-05-14 06:59:23.916121,2026-05-14 07:00:40.802714,0 days 00:01:16.886593,0,CAP_LAYER,0.45,SAME,0.7,4,0.05,0.02,0.3,0.08,3,1,0.5,5,WIDE_V2,0.5,,,,,,PRUNED
417,0.08459917202316417,2026-05-14 07:00:40.827965,2026-05-14 07:01:55.252056,0 days 00:01:14.424091,0,NO_NET_ADD,0.45,SAME,0.8,2,0.05,0.02,0.6,0.16,3,2,0.5,5,WIDE_V2,0.8,,,,,,PRUNED
418,-0.018993172965195926,2026-05-14 07:01:55.275549,2026-05-14 07:02:22.031143,0 days 00:00:26.755594,0,CAP_LAYER,0.25,SAME,0.9,2,0.03,0.01,0.6,0.08,3,2,0.5,20,WIDE_V2,0.5,,,,,,PRUNED
419,0.13788761010267137,2026-05-14 07:02:22.058010,2026-05-14 07:03:39.132159,0 days 00:01:17.074149,0,CAP_LAYER,0.45,SAME,0.9,4,0.03,0.02,0.6,0.16,3,2,0.5,5,WIDE_V2,0.5,,,,,,PRUNED
420,0.09174396098333962,2026-05-14 07:03:39.156365,2026-05-14 07:04:54.027795,0 days 00:01:14.871430,0,CAP_LAYER,0.25,SAME,0.7,2,0.05,0.02,0.6,0.08,3,2,0.5,5,WIDE_V2,0.8,,,,,,PRUNED
421,0.06299794666550018,2026-05-14 07:04:54.053400,2026-05-14 07:05:49.077709,0 days 00:00:55.024309,0,NO_NET_ADD,0.45,ETF_DEFENSIVE,0.7,2,0.05,0.02,0.6,0.08,3,2,0.5,5,WIDE_V2,0.5,,,,,,PRUNED
422,-9999.0,2026-05-14 07:05:49.105036,2026-05-14 07:05:49.465946,0 days 00:00:00.360910,1,CAP_LAYER,0.45,SAME,0.7,2,0.05,0.02,0.45,0.08,3,2,0.7,5,WIDE_V2,0.5,,,,,BEAR_RATIO < NEUTRAL_RATIO < BULL_RATIO 约束违反: 0.45 / 0.7 / 0.7,COMPLETE
423,0.22383628698321686,2026-05-14 07:05:49.490526,2026-05-14 07:07:20.134823,0 days 00:01:30.644297,0,CAP_LAYER,0.45,SAME,0.8,2,0.05,0.02,0.6,0.08,8,1,0.5,5,WIDE_V2,0.5,,,,,,PRUNED
424,-0.38676502638937227,2026-05-14 07:07:20.155813,2026-05-14 07:07:30.454101,0 days 00:00:10.298288,0,CAP_LAYER,0.45,SAME,0.9,2,0.05,0.02,0.6,0.16,3,2,0.5,5,ANCHOR_SATELLITE,0.5,,,,,,PRUNED
425,-0.5521156562426961,2026-05-14 07:07:30.480926,2026-05-14 07:11:30.732658,0 days 00:04:00.251732,0,CAP_LAYER,0.45,SAME,0.7,2,0.05,0.02,0.6,0.08,4,2,0.5,5,WIDE_V2,0.8,-0.13755029048659256,0.07963996822260598,0.8291307315122072,0.21719025870919856,,COMPLETE
426,-0.4589576217573321,2026-05-14 07:11:30.757702,2026-05-14 07:13:54.236679,0 days 00:02:23.478977,0,NORMAL,0.45,SAME,0.7,2,0.05,0.02,0.6,0.08,5,2,0.5,5,WIDE_V2,0.5,-0.09670448925375677,0.06655963806978193,0.7245062650071507,0.1632641273235387,,COMPLETE
427,0.19983077842948196,2026-05-14 07:13:54.264882,2026-05-14 07:15:22.436449,0 days 00:01:28.171567,0,CAP_LAYER,0.45,SAME,0.7,3,0.05,0.02,0.6,0.08,6,2,0.5,5,WIDE_V2,0.8,,,,,,PRUNED
428,0.21853335838851679,2026-05-14 07:15:22.458767,2026-05-14 07:16:44.940080,0 days 00:01:22.481313,0,NO_NET_ADD,0.45,SAME,0.8,2,0.05,0.02,0.6,0.08,3,2,0.5,5,WIDE_V2,0.5,,,,,,PRUNED
429,-0.3574296867331643,2026-05-14 07:16:44.963372,2026-05-14 07:16:56.332589,0 days 00:00:11.369217,0,CAP_LAYER,0.45,SAME,0.7,2,0.05,0.02,0.6,0.08,3,1,0.5,5,ANCHOR_SATELLITE,0.5,,,,,,PRUNED
430,0.23677312830160582,2026-05-14 07:16:56.358043,2026-05-14 07:18:12.579535,0 days 00:01:16.221492,0,CAP_LAYER,0.45,SAME,0.7,2,0.05,0.02,0.45,0.12,3,2,0.5,5,WIDE_V2,0.5,,,,,,PRUNED
431,0.23799538709797766,2026-05-14 07:18:12.604523,2026-05-14 07:19:43.219893,0 days 00:01:30.615370,0,CAP_LAYER,0.45,SAME,0.7,2,0.05,0.01,0.6,0.08,8,2,0.5,5,WIDE_V2,0.5,,,,,,PRUNED
432,0.05294271870518257,2026-05-14 07:19:43.243773,2026-05-14 07:20:37.740763,0 days 00:00:54.496990,0,CAP_LAYER,0.45,ETF_DEFENSIVE,0.7,2,0.05,0.02,0.6,0.08,3,2,0.6,5,WIDE_V2,0.5,,,,,,PRUNED
433,-0.45646097885391756,2026-05-14 07:20:37.764702,2026-05-14 07:20:59.147116,0 days 00:00:21.382414,0,CAP_LAYER,0.45,SAME,0.7,2,0.03,0.02,0.6,0.08,8,2,0.5,5,ANCHOR_SATELLITE,0.5,,,,,,PRUNED
434,0.21995503290893276,2026-05-14 07:20:59.173525,2026-05-14 07:22:12.882631,0 days 00:01:13.709106,0,CAP_LAYER,0.45,SAME,0.9,4,0.05,0.02,0.6,0.08,3,2,0.5,5,WIDE_V2,0.5,,,,,,PRUNED
435,-0.03571429631120299,2026-05-14 07:22:12.934245,2026-05-14 07:22:43.346735,0 days 00:00:30.412490,0,CAP_LAYER,0.45,SAME,0.8,2,0.05,0.02,0.45,0.08,5,2,0.5,20,WIDE_V2,0.5,,,,,,PRUNED
436,0.1293369190724471,2026-05-14 07:22:43.369548,2026-05-14 07:24:04.377745,0 days 00:01:21.008197,0,CAP_LAYER,0.35,SAME,0.7,2,0.05,0.02,0.6,0.12,3,2,0.5,5,WIDE_V2,0.8,,,,,,PRUNED
437,0.2249522372847977,2026-05-14 07:24:04.402529,2026-05-14 07:25:20.297752,0 days 00:01:15.895223,0,NORMAL,0.45,SAME,0.8,3,0.05,0.02,0.6,0.08,3,2,0.5,5,WIDE_V2,0.5,,,,,,PRUNED
438,0.1365594355518567,2026-05-14 07:25:20.318438,2026-05-14 07:26:58.009056,0 days 00:01:37.690618,0,CAP_LAYER,0.45,SAME,0.8,2,0.05,0.02,0.6,0.08,10,2,0.5,5,WIDE_V2,0.5,,,,,,PRUNED
439,-0.020511554692157957,2026-05-14 07:26:58.034103,2026-05-14 07:28:17.491335,0 days 00:01:19.457232,0,NO_NET_ADD,0.45,SAME,0.7,2,0.05,0.02,0.6,0.08,10,2,0.5,5,WIDE_V2,0.5,,,,,,PRUNED
440,0.1764323733707165,2026-05-14 07:28:17.525681,2026-05-14 07:29:34.455545,0 days 00:01:16.929864,0,CAP_LAYER,0.45,SAME,0.7,2,0.05,0.02,0.3,0.08,3,2,0.5,5,WIDE_V2,0.8,,,,,,PRUNED
441,-0.006295282391590662,2026-05-14 07:29:34.478800,2026-05-14 07:30:35.689342,0 days 00:01:01.210542,0,CAP_LAYER,0.25,ETF_DEFENSIVE,0.7,2,0.05,0.02,0.6,0.08,3,2,0.5,5,WIDE_V2,0.5,,,,,,PRUNED
442,0.23260337864165503,2026-05-14 07:30:35.715813,2026-05-14 07:31:48.278880,0 days 00:01:12.563067,0,NO_NET_ADD,0.45,SAME,0.7,2,0.05,0.02,0.45,0.08,3,2,0.5,5,WIDE_V2,0.5,,,,,,PRUNED
443,-9999.0,2026-05-14 07:31:48.301883,2026-05-14 07:31:48.612442,0 days 00:00:00.310559,0,CAP_LAYER,0.45,SAME,0.7,2,0.05,0.02,0.6,0.08,3,2,0.7,20,WIDE_V2,0.5,,,,,BEAR_RATIO < NEUTRAL_RATIO < BULL_RATIO 约束违反: 0.45 / 0.7 / 0.7,COMPLETE
444,-0.20592412420726164,2026-05-14 07:31:48.635246,2026-05-14 07:33:23.379389,0 days 00:01:34.744143,0,CAP_LAYER,0.45,SAME,0.7,2,0.05,0.02,0.6,0.08,10,2,0.5,5,WIDE_V2,0.8,,,,,,PRUNED
445,-9999.0,2026-05-14 07:33:23.405705,2026-05-14 07:33:23.760152,0 days 00:00:00.354447,0,CAP_LAYER,0.45,SAME,0.7,2,0.05,0.02,0.3,0.08,3,2,0.7,5,WIDE_V2,0.5,,,,,BEAR_RATIO < NEUTRAL_RATIO < BULL_RATIO 约束违反: 0.45 / 0.7 / 0.7,COMPLETE
446,-0.010465234969202625,2026-05-14 07:33:23.785600,2026-05-14 07:33:50.595655,0 days 00:00:26.810055,0,CAP_LAYER,0.45,SAME,0.7,2,0.05,0.02,0.6,0.08,3,1,0.5,20,WIDE_V2,0.5,,,,,,PRUNED
447,-0.5468546076554588,2026-05-14 07:33:50.620145,2026-05-14 07:37:52.598715,0 days 00:04:01.978570,0,CAP_LAYER,0.45,SAME,0.8,2,0.03,0.02,0.6,0.08,6,2,0.7,5,WIDE_V2,0.5,-0.13954699801088738,0.08973837002604755,0.8146152192891427,0.22928536803693494,,COMPLETE
448,0.2525461417764632,2026-05-14 07:37:52.623684,2026-05-14 07:39:08.820183,0 days 00:01:16.196499,0,CAP_LAYER,0.45,SAME,0.7,2,0.05,0.02,0.45,0.08,3,1,0.6,5,WIDE_V2,0.5,,,,,,PRUNED
449,0.2341731248582664,2026-05-14 07:39:08.845563,2026-05-14 07:40:24.554400,0 days 00:01:15.708837,0,CAP_LAYER,0.45,SAME,0.9,2,0.05,0.02,0.45,0.08,3,2,0.5,5,WIDE_V2,0.5,,,,,,PRUNED
450,0.1936964335364457,2026-05-14 07:40:24.579627,2026-05-14 07:41:38.503328,0 days 00:01:13.923701,0,CAP_LAYER,0.35,SAME,0.7,4,0.05,0.02,0.6,0.12,3,2,0.5,5,WIDE_V2,0.5,,,,,,PRUNED
451,-0.4784740465077116,2026-05-14 07:41:38.529091,2026-05-14 07:44:06.361899,0 days 00:02:27.832808,0,CAP_LAYER,0.45,SAME,0.7,4,0.05,0.02,0.6,0.16,5,2,0.5,5,WIDE_V2,0.5,-0.11141872585664991,-0.01650664156328378,0.7341106413021233,0.09491208429336613,,COMPLETE
452,0.1433211901973205,2026-05-14 07:44:06.387243,2026-05-14 07:45:41.331891,0 days 00:01:34.944648,0,CAP_LAYER,0.45,SAME,0.7,2,0.03,0.02,0.6,0.08,10,2,0.5,5,WIDE_V2,0.5,,,,,,PRUNED
453,-0.2005731583117847,2026-05-14 07:45:41.357587,2026-05-14 07:46:39.157639,0 days 00:00:57.800052,0,CAP_LAYER,0.45,ETF_DEFENSIVE,0.7,4,0.05,0.02,0.6,0.08,3,2,0.5,5,WIDE_V2,0.8,,,,,,PRUNED
454,0.2095438857940746,2026-05-14 07:46:39.182869,2026-05-14 07:48:01.549604,0 days 00:01:22.366735,0,CAP_LAYER,0.35,SAME,0.9,2,0.05,0.02,0.6,0.08,3,2,0.5,5,WIDE_V2,0.5,,,,,,PRUNED
455,0.214570958463217,2026-05-14 07:48:01.576751,2026-05-14 07:49:17.037972,0 days 00:01:15.461221,0,NORMAL,0.45,SAME,0.9,2,0.05,0.02,0.6,0.12,3,2,0.5,5,WIDE_V2,0.5,,,,,,PRUNED
456,0.2428538435475913,2026-05-14 07:49:17.064082,2026-05-14 07:50:34.665930,0 days 00:01:17.601848,0,NORMAL,0.45,SAME,0.7,2,0.05,0.02,0.45,0.08,3,2,0.6,5,WIDE_V2,0.5,,,,,,PRUNED
457,-0.04585922261405112,2026-05-14 07:50:34.692071,2026-05-14 07:50:59.071258,0 days 00:00:24.379187,0,CAP_LAYER,0.45,SAME,0.7,2,0.05,0.01,0.6,0.16,3,2,0.5,20,WIDE_V2,0.5,,,,,,PRUNED
458,-9999.0,2026-05-14 07:50:59.098305,2026-05-14 07:50:59.568815,0 days 00:00:00.470510,0,CAP_LAYER,0.45,SAME,0.7,2,0.05,0.02,0.6,0.08,3,1,0.7,5,WIDE_V2,0.5,,,,,BEAR_RATIO < NEUTRAL_RATIO < BULL_RATIO 约束违反: 0.45 / 0.7 / 0.7,COMPLETE
459,-0.04585922261405112,2026-05-14 07:50:59.593895,2026-05-14 07:51:20.556689,0 days 00:00:20.962794,0,CAP_LAYER,0.45,SAME,0.7,2,0.05,0.02,0.3,0.16,3,2,0.5,20,WIDE_V2,0.5,,,,,,PRUNED
460,0.13493854443465006,2026-05-14 07:51:20.582713,2026-05-14 07:52:36.810954,0 days 00:01:16.228241,0,CAP_LAYER,0.35,SAME,0.7,2,0.05,0.02,0.6,0.08,3,2,0.6,5,WIDE_V2,0.8,,,,,,PRUNED
461,-0.36365204164600984,2026-05-14 07:52:36.835600,2026-05-14 07:52:48.515606,0 days 00:00:11.680006,0,CAP_LAYER,0.45,SAME,0.7,4,0.05,0.02,0.6,0.08,3,2,0.5,5,ANCHOR_SATELLITE,0.5,,,,,,PRUNED
462,-0.36650393252114677,2026-05-14 07:52:48.541541,2026-05-14 07:52:53.715727,0 days 00:00:05.174186,1,CAP_LAYER,0.45,SAME,0.7,2,0.05,0.02,0.6,0.08,3,2,0.5,5,ANCHOR_SATELLITE,0.5,,,,,,PRUNED
463,-0.383486291644774,2026-05-14 07:52:53.743047,2026-05-14 07:56:42.576934,0 days 00:03:48.833887,0,NORMAL,0.45,SAME,0.9,2,0.05,0.01,0.6,0.08,3,2,0.5,5,WIDE_V2,0.65,-0.051880700909749784,0.06140835028490478,0.6632111814700484,0.11328905119465457,,COMPLETE
464,-0.43846404182164495,2026-05-14 07:56:42.605489,2026-05-14 07:58:59.212400,0 days 00:02:16.606911,0,NO_NET_ADD,0.45,SAME,0.9,2,0.05,0.02,0.6,0.08,3,2,0.5,5,WIDE_V2,0.65,-0.09919388741028012,0.052353009990638785,0.6785403088227296,0.15154689740091892,,COMPLETE
465,0.21056405285903532,2026-05-14 07:58:59.235960,2026-05-14 08:00:15.954323,0 days 00:01:16.718363,0,CAP_LAYER,0.45,SAME,0.8,4,0.03,0.02,0.6,0.08,3,2,0.5,5,WIDE_V2,0.5,,,,,,PRUNED
466,0.12360116264279597,2026-05-14 08:00:15.978898,2026-05-14 08:01:49.323760,0 days 00:01:33.344862,0,CAP_LAYER,0.45,SAME,0.7,2,0.05,0.02,0.6,0.08,10,2,0.6,5,WIDE_V2,0.65,,,,,,PRUNED
467,0.15166679668254252,2026-05-14 08:01:49.349098,2026-05-14 08:03:19.078963,0 days 00:01:29.729865,0,CAP_LAYER,0.45,SAME,0.8,2,0.03,0.02,0.6,0.08,5,2,0.5,5,WIDE_V2,0.8,,,,,,PRUNED
468,0.1173426148297246,2026-05-14 08:03:19.103306,2026-05-14 08:04:53.306261,0 days 00:01:34.202955,0,CAP_LAYER,0.45,SAME,0.7,2,0.05,0.01,0.6,0.16,10,2,0.5,5,WIDE_V2,0.5,,,,,,PRUNED
469,0.0253710107811985,2026-05-14 08:04:53.332437,2026-05-14 08:05:50.397777,0 days 00:00:57.065340,0,CAP_LAYER,0.45,ETF_DEFENSIVE,0.7,2,0.05,0.02,0.6,0.16,3,2,0.5,5,WIDE_V2,0.5,,,,,,PRUNED
470,0.1764323733707165,2026-05-14 08:05:50.423471,2026-05-14 08:07:06.343471,0 days 00:01:15.920000,0,CAP_LAYER,0.45,SAME,0.7,2,0.05,0.01,0.6,0.08,3,2,0.5,5,WIDE_V2,0.8,,,,,,PRUNED
471,-0.311943513174594,2026-05-14 08:07:06.390787,2026-05-14 08:07:07.023515,0 days 00:00:00.632728,0,CAP_LAYER,0.45,SAME,0.7,2,0.05,0.02,0.6,0.08,3,2,0.5,5,WIDE_V2,0.5,-0.03503602807514746,0.0022846139529225295,0.5538149701988931,0.03732064202806999,,COMPLETE
472,0.20295237329059357,2026-05-14 08:07:07.048497,2026-05-14 08:08:25.538404,0 days 00:01:18.489907,0,NO_NET_ADD,0.45,SAME,0.7,2,0.05,0.02,0.6,0.12,3,2,0.5,5,WIDE_V2,0.5,,,,,,PRUNED
473,0.026090614122970708,2026-05-14 08:08:25.566674,2026-05-14 08:09:22.628231,0 days 00:00:57.061557,0,CAP_LAYER,0.45,ETF_DEFENSIVE,0.7,3,0.05,0.02,0.6,0.12,3,2,0.5,5,WIDE_V2,0.5,,,,,,PRUNED
474,0.2360364199457966,2026-05-14 08:09:22.653255,2026-05-14 08:10:40.281159,0 days 00:01:17.627904,0,CAP_LAYER,0.45,SAME,0.7,3,0.03,0.02,0.6,0.08,3,2,0.5,5,WIDE_V2,0.5,,,,,,PRUNED
475,0.22455276295754228,2026-05-14 08:10:40.304847,2026-05-14 08:11:56.507989,0 days 00:01:16.203142,0,CAP_LAYER,0.45,SAME,0.7,3,0.05,0.02,0.6,0.12,3,2,0.5,5,WIDE_V2,0.5,,,,,,PRUNED
476,-0.38467128086188396,2026-05-14 08:11:56.532215,2026-05-14 08:15:45.990517,0 days 00:03:49.458302,1,CAP_LAYER,0.45,SAME,0.9,2,0.05,0.02,0.6,0.08,3,2,0.5,5,WIDE_V2,0.65,-0.05512787666935905,0.05840829365225516,0.6590868083850498,0.1135361703216142,,COMPLETE
477,-0.42941651120110014,2026-05-14 08:15:46.015241,2026-05-14 08:18:11.999349,0 days 00:02:25.984108,0,CAP_LAYER,0.25,SAME,0.7,2,0.05,0.02,0.6,0.08,4,2,0.5,5,WIDE_V2,0.5,-0.08741353260311546,0.11123170606607624,0.6840059571959693,0.1986452386691917,,COMPLETE
478,0.12983577624092932,2026-05-14 08:18:12.022883,2026-05-14 08:19:47.164609,0 days 00:01:35.141726,0,CAP_LAYER,0.25,SAME,0.7,2,0.05,0.02,0.6,0.08,10,2,0.5,5,WIDE_V2,0.65,,,,,,PRUNED
479,-0.41703352875358685,2026-05-14 08:19:47.186228,2026-05-14 08:19:57.850750,0 days 00:00:10.664522,0,CAP_LAYER,0.45,SAME,0.9,2,0.05,0.02,0.6,0.08,3,2,0.6,5,ANCHOR_SATELLITE,0.5,,,,,,PRUNED
480,-0.311943513174594,2026-05-14 08:19:57.875326,2026-05-14 08:19:58.434464,0 days 00:00:00.559138,0,CAP_LAYER,0.45,SAME,0.7,2,0.05,0.02,0.6,0.08,3,2,0.5,5,WIDE_V2,0.5,-0.03503602807514746,0.0022846139529225295,0.5538149701988931,0.03732064202806999,,COMPLETE
481,0.23085064372533984,2026-05-14 08:19:58.458848,2026-05-14 08:21:16.818848,0 days 00:01:18.360000,0,NORMAL,0.45,SAME,0.7,2,0.03,0.02,0.6,0.08,3,2,0.5,5,WIDE_V2,0.5,,,,,,PRUNED
482,0.002213150564736005,2026-05-14 08:21:16.861724,2026-05-14 08:21:43.935380,0 days 00:00:27.073656,1,NO_NET_ADD,0.45,SAME,0.7,2,0.05,0.01,0.6,0.08,3,2,0.5,20,WIDE_V2,0.5,,,,,,PRUNED
483,-9999.0,2026-05-14 08:21:43.960170,2026-05-14 08:21:44.334195,0 days 00:00:00.374025,0,CAP_LAYER,0.45,SAME,0.7,2,0.05,0.02,0.6,0.08,6,2,0.7,5,WIDE_V2,0.5,,,,,BEAR_RATIO < NEUTRAL_RATIO < BULL_RATIO 约束违反: 0.45 / 0.7 / 0.7,COMPLETE
484,-0.37195773371672586,2026-05-14 08:21:44.359305,2026-05-14 08:25:43.277749,0 days 00:03:58.918444,0,NORMAL,0.45,SAME,0.7,2,0.05,0.02,0.45,0.08,4,2,0.5,5,WIDE_V2,0.5,-0.030844552311365087,0.14302972853076437,0.6822263628107216,0.17387428084212947,,COMPLETE
485,-0.5295487139656885,2026-05-14 08:25:43.301968,2026-05-14 08:28:10.982228,0 days 00:02:27.680260,0,CAP_LAYER,0.25,SAME,0.7,2,0.05,0.02,0.6,0.16,5,2,0.5,5,WIDE_V2,0.5,-0.16726091216163272,0.0031210173504391497,0.7245756036081116,0.17038192951207187,,COMPLETE
486,0.21206935564647728,2026-05-14 08:28:11.005164,2026-05-14 08:29:26.468885,0 days 00:01:15.463721,0,CAP_LAYER,0.45,SAME,0.8,2,0.05,0.02,0.6,0.16,3,2,0.5,5,WIDE_V2,0.5,,,,,,PRUNED
487,0.2504416468491144,2026-05-14 08:29:26.494701,2026-05-14 08:30:43.942979,0 days 00:01:17.448278,1,CAP_LAYER,0.45,SAME,0.7,2,0.05,0.01,0.6,0.08,3,2,0.5,5,WIDE_V2,0.5,,,,,,PRUNED
488,-0.4265951208618181,2026-05-14 08:30:43.966677,2026-05-14 08:32:00.905556,0 days 00:01:16.938879,0,CAP_LAYER,0.45,SAME,0.7,2,0.05,0.02,0.6,0.08,4,2,0.6,10,WIDE_V2,0.5,-0.07600035992900088,0.18709275521168495,0.7011895218656344,0.26309311514068584,,COMPLETE
489,-0.25924384601407274,2026-05-14 08:32:00.926408,2026-05-14 08:32:26.658024,0 days 00:00:25.731616,0,CAP_LAYER,0.45,SAME,0.7,2,0.05,0.02,0.6,0.12,3,2,0.5,20,WIDE_V2,0.8,,,,,,PRUNED
490,0.243571435401933,2026-05-14 08:32:26.681873,2026-05-14 08:33:43.075681,0 days 00:01:16.393808,0,CAP_LAYER,0.45,SAME,0.8,2,0.05,0.02,0.3,0.08,3,2,0.5,5,WIDE_V2,0.5,,,,,,PRUNED
491,0.0429598067542504,2026-05-14 08:33:43.103141,2026-05-14 08:34:49.565241,0 days 00:01:06.462100,0,CAP_LAYER,0.45,ETF_DEFENSIVE,0.7,2,0.05,0.02,0.6,0.08,8,2,0.5,5,WIDE_V2,0.5,,,,,,PRUNED
492,-0.311943513174594,2026-05-14 08:34:49.591239,2026-05-14 08:37:36.246323,0 days 00:02:46.655084,0,CAP_LAYER,0.45,SAME,0.7,2,0.05,0.01,0.3,0.08,3,2,0.5,5,WIDE_V2,0.5,-0.03503602807514746,0.0022846139529225295,0.5538149701988931,0.03732064202806999,,COMPLETE
493,0.2398431574864526,2026-05-14 08:37:36.268332,2026-05-14 08:38:52.670353,0 days 00:01:16.402021,0,CAP_LAYER,0.45,SAME,0.8,2,0.05,0.02,0.6,0.08,3,2,0.6,5,WIDE_V2,0.5,,,,,,PRUNED
494,-0.5223759054079148,2026-05-14 08:38:52.692559,2026-05-14 08:42:08.144926,0 days 00:03:15.452367,0,CAP_LAYER,0.45,SAME,0.7,2,0.05,0.02,0.6,0.12,6,2,0.5,5,WIDE_V2,0.5,-0.12580473769231168,0.05074660470843918,0.7931423354312062,0.17655134240075088,,COMPLETE
