number,value,datetime_start,datetime_complete,duration,params_BEAR_GRID_MAX_LAYER_CAP,params_BEAR_GRID_MODE,params_BEAR_RATIO,params_BEAR_UNIVERSE_MODE,params_BULL_RATIO,params_GRID_MAX_LAYER,params_GRID_STEP_MAX,params_GRID_STEP_MIN,params_GRID_STEP_VOL_FACTOR,params_LAYER_FRACTION,params_MAX_HOLD,params_MIN_ANCHORS_IN_POOL,params_NEUTRAL_RATIO,params_REBALANCE_FREQ,params_UNIVERSE_MODE,params_VOL_WEIGHT,user_attrs_avg_test_score,user_attrs_avg_train_score,user_attrs_test_score_std,user_attrs_train_test_gap,user_attrs_validation_error,state
600,-0.39528752388337,2026-05-14 10:37:58.615321,2026-05-14 10:38:05.353355,0 days 00:00:06.738034,0,CAP_LAYER,0.45,SAME,0.7,2,0.05,0.02,0.6,0.08,3,2,0.5,20,ANCHOR_SATELLITE,0.5,,,,,,PRUNED
601,0.22427127048732554,2026-05-14 10:38:05.377765,2026-05-14 10:39:24.099722,0 days 00:01:18.721957,0,CAP_LAYER,0.45,SAME,0.7,2,0.05,0.02,0.6,0.16,3,1,0.5,5,WIDE_V2,0.5,,,,,,PRUNED
602,0.25099239456903844,2026-05-14 10:39:24.124103,2026-05-14 10:40:38.522738,0 days 00:01:14.398635,0,NORMAL,0.45,SAME,0.7,2,0.05,0.02,0.3,0.08,3,2,0.5,5,WIDE_V2,0.5,,,,,,PRUNED
603,0.23692237431590019,2026-05-14 10:40:38.551001,2026-05-14 10:41:58.779194,0 days 00:01:20.228193,0,NORMAL,0.45,SAME,0.8,2,0.05,0.02,0.6,0.08,3,2,0.5,5,WIDE_V2,0.5,,,,,,PRUNED
604,0.1634642606441516,2026-05-14 10:41:58.797916,2026-05-14 10:43:12.517783,0 days 00:01:13.719867,0,CAP_LAYER,0.45,SAME,0.8,2,0.05,0.02,0.6,0.08,3,2,0.5,5,WIDE_V2,0.8,,,,,,PRUNED
605,0.15866320899205216,2026-05-14 10:43:12.541331,2026-05-14 10:44:29.334201,0 days 00:01:16.792870,0,CAP_LAYER,0.45,SAME,0.7,3,0.05,0.02,0.6,0.08,3,2,0.5,5,WIDE_V2,0.8,,,,,,PRUNED
606,-0.010465234969202625,2026-05-14 10:44:29.356617,2026-05-14 10:44:48.674494,0 days 00:00:19.317877,0,CAP_LAYER,0.45,SAME,0.7,2,0.05,0.02,0.45,0.08,3,2,0.5,20,WIDE_V2,0.5,,,,,,PRUNED
607,0.25099239456903844,2026-05-14 10:44:48.698781,2026-05-14 10:46:05.455660,0 days 00:01:16.756879,0,NORMAL,0.45,SAME,0.7,2,0.05,0.02,0.6,0.08,3,1,0.5,5,WIDE_V2,0.5,,,,,,PRUNED
608,0.23154634286269926,2026-05-14 10:46:05.479525,2026-05-14 10:47:24.847413,0 days 00:01:19.367888,0,CAP_LAYER,0.45,SAME,0.8,3,0.05,0.02,0.6,0.08,3,2,0.5,5,WIDE_V2,0.5,,,,,,PRUNED
609,-0.311943513174594,2026-05-14 10:47:24.868769,2026-05-14 10:51:11.196028,0 days 00:03:46.327259,0,CAP_LAYER,0.45,SAME,0.7,2,0.05,0.01,0.45,0.08,3,2,0.5,5,WIDE_V2,0.5,-0.03503602807514746,0.0022846139529225295,0.5538149701988931,0.03732064202806999,,COMPLETE
610,0.14070520143804827,2026-05-14 10:51:11.220418,2026-05-14 10:52:12.984772,0 days 00:01:01.764354,0,CAP_LAYER,0.45,ETF_DEFENSIVE,0.7,2,0.03,0.02,0.6,0.08,5,2,0.6,5,WIDE_V2,0.5,,,,,,PRUNED
611,-9999.0,2026-05-14 10:52:13.007538,2026-05-14 10:52:13.358365,0 days 00:00:00.350827,0,CAP_LAYER,0.45,SAME,0.7,2,0.05,0.02,0.6,0.12,3,2,0.7,5,WIDE_V2,0.5,,,,,BEAR_RATIO < NEUTRAL_RATIO < BULL_RATIO 约束违反: 0.45 / 0.7 / 0.7,COMPLETE
612,0.05479446014255376,2026-05-14 10:52:13.402167,2026-05-14 10:53:07.580143,0 days 00:00:54.177976,0,CAP_LAYER,0.45,ETF_DEFENSIVE,0.7,3,0.05,0.02,0.6,0.08,3,2,0.5,5,WIDE_V2,0.5,,,,,,PRUNED
613,0.08675774247448453,2026-05-14 10:53:07.603393,2026-05-14 10:53:50.643552,0 days 00:00:43.040159,0,CAP_LAYER,0.35,SAME,0.7,4,0.05,0.02,0.6,0.08,10,2,0.5,20,WIDE_V2,0.5,,,,,,PRUNED
614,0.23301221659087937,2026-05-14 10:53:50.677903,2026-05-14 10:55:11.702988,0 days 00:01:21.025085,0,CAP_LAYER,0.35,SAME,0.7,2,0.05,0.02,0.45,0.08,3,2,0.5,5,WIDE_V2,0.5,,,,,,PRUNED
615,0.23236653050138162,2026-05-14 10:55:11.728719,2026-05-14 10:56:42.267416,0 days 00:01:30.538697,0,CAP_LAYER,0.45,SAME,0.7,2,0.05,0.02,0.6,0.08,8,2,0.6,5,WIDE_V2,0.5,,,,,,PRUNED
616,0.1580173175372289,2026-05-14 10:56:42.290959,2026-05-14 10:57:59.305576,0 days 00:01:17.014617,0,NO_NET_ADD,0.45,SAME,0.7,2,0.05,0.02,0.6,0.16,3,2,0.5,5,WIDE_V2,0.5,,,,,,PRUNED
617,-0.42941651120110014,2026-05-14 10:57:59.325083,2026-05-14 11:01:48.824179,0 days 00:03:49.499096,0,CAP_LAYER,0.25,SAME,0.7,2,0.05,0.02,0.45,0.08,4,1,0.5,5,WIDE_V2,0.5,-0.08741353260311546,0.11123170606607624,0.6840059571959693,0.1986452386691917,,COMPLETE
618,-0.46090826143023556,2026-05-14 11:01:48.849215,2026-05-14 11:04:16.297054,0 days 00:02:27.447839,0,CAP_LAYER,0.45,SAME,0.7,2,0.05,0.02,0.6,0.12,5,2,0.5,5,WIDE_V2,0.5,-0.09167061827024216,0.05027721073604553,0.7384752863199868,0.1419478290062877,,COMPLETE
619,-9999.0,2026-05-14 11:04:16.321326,2026-05-14 11:04:16.727832,0 days 00:00:00.406506,0,NO_NET_ADD,0.45,ETF_DEFENSIVE,0.7,3,0.05,0.02,0.6,0.08,3,2,0.7,20,WIDE_V2,0.5,,,,,BEAR_RATIO < NEUTRAL_RATIO < BULL_RATIO 约束违反: 0.45 / 0.7 / 0.7,COMPLETE
620,0.16408033104380926,2026-05-14 11:04:16.764807,2026-05-14 11:05:34.071789,0 days 00:01:17.306982,0,NO_NET_ADD,0.25,SAME,0.7,2,0.05,0.02,0.6,0.08,3,2,0.5,5,WIDE_V2,0.5,,,,,,PRUNED
621,0.243571435401933,2026-05-14 11:05:34.097078,2026-05-14 11:06:47.740293,0 days 00:01:13.643215,0,CAP_LAYER,0.45,SAME,0.8,2,0.05,0.02,0.45,0.08,3,2,0.5,5,WIDE_V2,0.5,,,,,,PRUNED
622,-0.36579043192215727,2026-05-14 11:06:47.764820,2026-05-14 11:06:59.214583,0 days 00:00:11.449763,0,CAP_LAYER,0.45,SAME,0.7,2,0.05,0.02,0.6,0.16,3,2,0.5,5,ANCHOR_SATELLITE,0.5,,,,,,PRUNED
623,0.160753741319763,2026-05-14 11:06:59.238639,2026-05-14 11:07:38.113151,0 days 00:00:38.874512,0,CAP_LAYER,0.45,SAME,0.7,2,0.05,0.02,0.6,0.08,3,2,0.6,10,WIDE_V2,0.5,,,,,,PRUNED
624,0.0273812102942243,2026-05-14 11:07:38.139014,2026-05-14 11:08:04.511518,0 days 00:00:26.372504,0,CAP_LAYER,0.45,ETF_DEFENSIVE,0.7,2,0.05,0.01,0.6,0.08,6,2,0.5,20,WIDE_V2,0.5,,,,,,PRUNED
625,-0.055704959561711564,2026-05-14 11:08:04.536808,2026-05-14 11:09:15.590375,0 days 00:01:11.053567,0,CAP_LAYER,0.45,ETF_DEFENSIVE,0.9,2,0.03,0.02,0.6,0.08,10,2,0.5,5,WIDE_V2,0.5,,,,,,PRUNED
626,-9999.0,2026-05-14 11:09:15.613746,2026-05-14 11:09:15.981715,0 days 00:00:00.367969,0,CAP_LAYER,0.45,SAME,0.7,2,0.05,0.02,0.6,0.08,3,2,0.7,10,WIDE_V2,0.5,,,,,BEAR_RATIO < NEUTRAL_RATIO < BULL_RATIO 约束违反: 0.45 / 0.7 / 0.7,COMPLETE
627,0.16740930970812568,2026-05-14 11:09:16.005259,2026-05-14 11:09:53.533370,0 days 00:00:37.528111,0,CAP_LAYER,0.45,SAME,0.8,2,0.05,0.02,0.6,0.08,3,2,0.5,10,WIDE_V2,0.5,,,,,,PRUNED
628,0.11126196289980969,2026-05-14 11:09:53.558037,2026-05-14 11:11:13.653856,0 days 00:01:20.095819,0,NORMAL,0.45,SAME,0.8,2,0.05,0.02,0.6,0.12,3,2,0.6,5,WIDE_V2,0.8,,,,,,PRUNED
629,-0.357689193182343,2026-05-14 11:11:13.678521,2026-05-14 11:11:18.790503,0 days 00:00:05.111982,0,CAP_LAYER,0.45,SAME,0.7,2,0.05,0.02,0.45,0.08,3,2,0.5,5,ANCHOR_SATELLITE,0.5,,,,,,PRUNED
630,-9999.0,2026-05-14 11:11:18.839971,2026-05-14 11:11:19.204587,0 days 00:00:00.364616,0,NO_NET_ADD,0.45,SAME,0.7,2,0.05,0.02,0.6,0.08,6,2,0.7,5,ANCHOR_SATELLITE,0.5,,,,,BEAR_RATIO < NEUTRAL_RATIO < BULL_RATIO 约束违反: 0.45 / 0.7 / 0.7,COMPLETE
631,-0.348826446529591,2026-05-14 11:11:19.231107,2026-05-14 11:15:03.441587,0 days 00:03:44.210480,0,CAP_LAYER,0.45,SAME,0.7,2,0.05,0.02,0.6,0.08,3,1,0.5,5,WIDE_V2,0.65,-0.021232264479312257,0.046847227582617286,0.6551883641005575,0.06807949206192954,,COMPLETE
632,0.19797526549552188,2026-05-14 11:15:03.484039,2026-05-14 11:16:21.126444,0 days 00:01:17.642405,1,CAP_LAYER,0.25,SAME,0.7,2,0.05,0.02,0.6,0.08,3,2,0.5,5,WIDE_V2,0.5,,,,,,PRUNED
633,-0.056446241072054815,2026-05-14 11:16:21.150227,2026-05-14 11:16:51.542164,0 days 00:00:30.391937,1,CAP_LAYER,0.35,SAME,0.7,2,0.05,0.02,0.6,0.16,5,2,0.6,20,WIDE_V2,0.5,,,,,,PRUNED
634,-0.5134843476924797,2026-05-14 11:16:51.566122,2026-05-14 11:19:19.721803,0 days 00:02:28.155681,0,CAP_LAYER,0.45,SAME,0.7,2,0.03,0.02,0.6,0.08,6,2,0.5,5,WIDE_V2,0.5,-0.12310003576894306,0.061254300593328766,0.7807686238470735,0.18435433636227183,,COMPLETE
635,0.06633754884701801,2026-05-14 11:19:19.745881,2026-05-14 11:20:13.979339,0 days 00:00:54.233458,0,NORMAL,0.45,ETF_DEFENSIVE,0.7,2,0.05,0.02,0.6,0.08,3,2,0.5,5,WIDE_V2,0.5,,,,,,PRUNED
636,0.21697933357443014,2026-05-14 11:20:14.004455,2026-05-14 11:21:28.938551,0 days 00:01:14.934096,0,CAP_LAYER,0.35,SAME,0.8,2,0.03,0.02,0.6,0.08,3,2,0.5,5,WIDE_V2,0.5,,,,,,PRUNED
637,0.23260337864165503,2026-05-14 11:21:28.962705,2026-05-14 11:22:42.608286,0 days 00:01:13.645581,0,NO_NET_ADD,0.45,SAME,0.7,2,0.05,0.02,0.6,0.08,3,1,0.5,5,WIDE_V2,0.5,,,,,,PRUNED
638,-0.0037673626133946925,2026-05-14 11:22:42.630991,2026-05-14 11:23:05.140160,0 days 00:00:22.509169,1,CAP_LAYER,0.45,SAME,0.7,2,0.05,0.02,0.6,0.08,3,2,0.5,20,WIDE_V2,0.5,,,,,,PRUNED
639,-0.311943513174594,2026-05-14 11:23:05.160649,2026-05-14 11:23:05.751046,0 days 00:00:00.590397,0,CAP_LAYER,0.45,SAME,0.7,2,0.05,0.02,0.6,0.08,3,2,0.5,5,WIDE_V2,0.5,-0.03503602807514746,0.0022846139529225295,0.5538149701988931,0.03732064202806999,,COMPLETE
640,0.060319383577131354,2026-05-14 11:23:05.772249,2026-05-14 11:24:07.521020,0 days 00:01:01.748771,0,CAP_LAYER,0.45,ETF_DEFENSIVE,0.7,2,0.03,0.02,0.6,0.08,3,2,0.5,5,WIDE_V2,0.5,,,,,,PRUNED
641,0.2504416468491144,2026-05-14 11:24:07.545617,2026-05-14 11:25:23.787846,0 days 00:01:16.242229,1,CAP_LAYER,0.45,SAME,0.7,2,0.05,0.02,0.3,0.08,3,2,0.5,5,WIDE_V2,0.5,,,,,,PRUNED
642,-0.311943513174594,2026-05-14 11:25:23.814077,2026-05-14 11:25:24.364700,0 days 00:00:00.550623,0,CAP_LAYER,0.45,SAME,0.7,2,0.05,0.02,0.6,0.08,3,2,0.5,5,WIDE_V2,0.5,-0.03503602807514746,0.0022846139529225295,0.5538149701988931,0.03732064202806999,,COMPLETE
643,0.13739024594489382,2026-05-14 11:25:24.397922,2026-05-14 11:26:56.446943,0 days 00:01:32.049021,0,CAP_LAYER,0.45,SAME,0.7,3,0.05,0.02,0.6,0.08,10,2,0.5,5,WIDE_V2,0.5,,,,,,PRUNED
644,0.2004643939141702,2026-05-14 11:26:56.471358,2026-05-14 11:28:28.772313,0 days 00:01:32.300955,0,CAP_LAYER,0.45,SAME,0.9,2,0.03,0.02,0.6,0.08,8,2,0.5,5,WIDE_V2,0.5,,,,,,PRUNED
645,0.17210741668826024,2026-05-14 11:28:28.797793,2026-05-14 11:29:08.845251,0 days 00:00:40.047458,0,CAP_LAYER,0.45,SAME,0.7,2,0.03,0.02,0.6,0.08,3,2,0.5,10,WIDE_V2,0.5,,,,,,PRUNED
646,0.20500384534024169,2026-05-14 11:29:08.869185,2026-05-14 11:30:24.774412,0 days 00:01:15.905227,1,CAP_LAYER,0.45,SAME,0.7,4,0.05,0.02,0.6,0.12,3,2,0.5,5,WIDE_V2,0.5,,,,,,PRUNED
647,-9999.0,2026-05-14 11:30:24.799097,2026-05-14 11:30:25.171721,0 days 00:00:00.372624,0,CAP_LAYER,0.45,SAME,0.7,2,0.05,0.02,0.6,0.08,3,2,0.7,5,WIDE_V2,0.8,,,,,BEAR_RATIO < NEUTRAL_RATIO < BULL_RATIO 约束违反: 0.45 / 0.7 / 0.7,COMPLETE
648,0.22752406377223366,2026-05-14 11:30:25.195218,2026-05-14 11:31:39.785013,0 days 00:01:14.589795,0,NORMAL,0.45,SAME,0.9,2,0.05,0.02,0.6,0.08,3,2,0.5,5,WIDE_V2,0.5,,,,,,PRUNED
649,0.14275665179139344,2026-05-14 11:31:39.832768,2026-05-14 11:32:19.767463,0 days 00:00:39.934695,0,CAP_LAYER,0.45,SAME,0.7,2,0.05,0.02,0.6,0.16,3,2,0.5,10,WIDE_V2,0.5,,,,,,PRUNED
650,0.20831119038903112,2026-05-14 11:32:19.790505,2026-05-14 11:33:36.777077,0 days 00:01:16.986572,0,CAP_LAYER,0.35,SAME,0.7,2,0.03,0.02,0.6,0.08,8,2,0.5,5,WIDE_V2,0.5,,,,,,PRUNED
651,0.2450546196583624,2026-05-14 11:33:36.800072,2026-05-14 11:34:49.009780,0 days 00:01:12.209708,0,CAP_LAYER,0.45,SAME,0.7,4,0.05,0.02,0.6,0.08,3,2,0.6,5,WIDE_V2,0.5,,,,,,PRUNED
652,0.21837953669343413,2026-05-14 11:34:49.035131,2026-05-14 11:36:11.171637,0 days 00:01:22.136506,0,CAP_LAYER,0.35,SAME,0.7,2,0.05,0.02,0.6,0.08,8,2,0.5,5,WIDE_V2,0.5,,,,,,PRUNED
653,-0.48018828132353597,2026-05-14 11:36:11.200610,2026-05-14 11:36:19.044290,0 days 00:00:07.843680,1,CAP_LAYER,0.45,SAME,0.8,3,0.05,0.02,0.3,0.16,3,1,0.6,20,ANCHOR_SATELLITE,0.5,,,,,,PRUNED
654,0.18687001077526696,2026-05-14 11:36:19.069439,2026-05-14 11:37:34.761514,0 days 00:01:15.692075,0,CAP_LAYER,0.25,SAME,0.7,4,0.05,0.02,0.6,0.08,3,2,0.5,5,WIDE_V2,0.5,,,,,,PRUNED
655,-0.44549036316150736,2026-05-14 11:37:34.784523,2026-05-14 11:38:32.313245,0 days 00:00:57.528722,0,NO_NET_ADD,0.45,SAME,0.8,2,0.05,0.02,0.45,0.12,10,1,0.6,10,WIDE_V2,0.8,,,,,,PRUNED
656,0.23036117719429222,2026-05-14 11:38:32.337369,2026-05-14 11:39:56.122337,0 days 00:01:23.784968,1,CAP_LAYER,0.45,SAME,0.7,2,0.05,0.02,0.6,0.08,8,2,0.5,5,WIDE_V2,0.5,,,,,,PRUNED
657,-0.3631792611469676,2026-05-14 11:39:56.144518,2026-05-14 11:43:43.534688,0 days 00:03:47.390170,0,CAP_LAYER,0.45,SAME,0.7,2,0.05,0.02,0.6,0.08,3,2,0.6,5,WIDE_V2,0.65,-0.024126554425277336,0.06126690672991458,0.6781054134433805,0.08539346115519192,,COMPLETE
658,0.1750152396470641,2026-05-14 11:43:43.560646,2026-05-14 11:44:25.192069,0 days 00:00:41.631423,0,CAP_LAYER,0.45,SAME,0.7,2,0.05,0.02,0.45,0.08,3,2,0.5,10,WIDE_V2,0.5,,,,,,PRUNED
659,0.1764323733707165,2026-05-14 11:44:25.215615,2026-05-14 11:45:42.883201,0 days 00:01:17.667586,0,CAP_LAYER,0.45,SAME,0.7,2,0.05,0.02,0.6,0.08,3,1,0.5,5,WIDE_V2,0.8,,,,,,PRUNED
660,0.23902854384095407,2026-05-14 11:45:42.933670,2026-05-14 11:46:58.696906,0 days 00:01:15.763236,1,CAP_LAYER,0.45,SAME,0.7,2,0.03,0.02,0.6,0.08,3,2,0.5,5,WIDE_V2,0.5,,,,,,PRUNED
661,-0.17041611989310568,2026-05-14 11:46:58.720697,2026-05-14 11:47:11.813987,0 days 00:00:13.093290,0,CAP_LAYER,0.45,SAME,0.7,2,0.05,0.02,0.6,0.08,4,2,0.5,5,ANCHOR_SATELLITE,0.5,,,,,,PRUNED
662,0.1576599310935132,2026-05-14 11:47:11.838123,2026-05-14 11:47:52.014024,0 days 00:00:40.175901,0,CAP_LAYER,0.45,SAME,0.7,4,0.05,0.02,0.6,0.08,3,2,0.5,10,WIDE_V2,0.5,,,,,,PRUNED
663,-0.43327293905364395,2026-05-14 11:47:52.040840,2026-05-14 11:48:05.670982,0 days 00:00:13.630142,1,NORMAL,0.45,SAME,0.9,4,0.05,0.02,0.45,0.12,8,2,0.5,10,ANCHOR_SATELLITE,0.65,,,,,,PRUNED
664,0.21297354681995054,2026-05-14 11:48:05.697990,2026-05-14 11:49:26.317075,0 days 00:01:20.619085,0,NO_NET_ADD,0.45,SAME,0.7,4,0.05,0.02,0.6,0.08,3,2,0.5,5,WIDE_V2,0.5,,,,,,PRUNED
665,0.15898084156683367,2026-05-14 11:49:26.343070,2026-05-14 11:50:09.166792,0 days 00:00:42.823722,0,CAP_LAYER,0.45,SAME,0.7,2,0.05,0.02,0.6,0.12,3,2,0.5,10,WIDE_V2,0.5,,,,,,PRUNED
666,0.22401950748658989,2026-05-14 11:50:09.191396,2026-05-14 11:51:24.117766,0 days 00:01:14.926370,0,CAP_LAYER,0.35,SAME,0.7,2,0.05,0.02,0.6,0.08,3,2,0.6,5,WIDE_V2,0.5,,,,,,PRUNED
667,-0.5289163075211724,2026-05-14 11:51:24.141361,2026-05-14 11:55:25.854265,0 days 00:04:01.712904,0,CAP_LAYER,0.25,SAME,0.7,2,0.05,0.02,0.6,0.08,6,2,0.5,5,WIDE_V2,0.5,-0.15885878871056575,0.053909998483479736,0.7401150376212132,0.2127687871940455,,COMPLETE
668,-0.4645713231565823,2026-05-14 11:55:25.878467,2026-05-14 11:56:43.444086,0 days 00:01:17.565619,0,CAP_LAYER,0.45,SAME,0.7,2,0.05,0.02,0.6,0.08,5,2,0.5,10,WIDE_V2,0.5,-0.10083579764986607,0.11180498440982478,0.7274710510134325,0.21264078205969084,,COMPLETE
669,0.23581551128132827,2026-05-14 11:56:43.466072,2026-05-14 11:58:04.379389,0 days 00:01:20.913317,1,NORMAL,0.35,SAME,0.7,2,0.05,0.02,0.45,0.08,3,2,0.5,5,WIDE_V2,0.5,,,,,,PRUNED
670,-0.016837664456272744,2026-05-14 11:58:04.399329,2026-05-14 11:58:28.674386,0 days 00:00:24.275057,0,CAP_LAYER,0.25,SAME,0.7,2,0.05,0.02,0.6,0.08,3,2,0.5,20,WIDE_V2,0.5,,,,,,PRUNED
671,0.17053761152647814,2026-05-14 11:58:28.700196,2026-05-14 11:59:46.635267,0 days 00:01:17.935071,0,CAP_LAYER,0.25,SAME,0.8,4,0.05,0.02,0.6,0.08,3,1,0.5,5,WIDE_V2,0.5,,,,,,PRUNED
672,0.24929021699652526,2026-05-14 11:59:46.659265,2026-05-14 12:00:59.583927,0 days 00:01:12.924662,0,CAP_LAYER,0.45,SAME,0.7,3,0.05,0.02,0.6,0.08,3,2,0.6,5,WIDE_V2,0.5,,,,,,PRUNED
673,-0.377111909993322,2026-05-14 12:00:59.606873,2026-05-14 12:03:54.210397,0 days 00:02:54.603524,1,CAP_LAYER,0.45,SAME,0.7,2,0.05,0.02,0.45,0.08,4,2,0.5,5,WIDE_V2,0.5,-0.03470009326212321,0.14248287052715766,0.6848236334623976,0.1771829637892809,,COMPLETE
674,-0.03314080636521144,2026-05-14 12:03:54.233879,2026-05-14 12:04:17.298786,0 days 00:00:23.064907,0,CAP_LAYER,0.45,SAME,0.7,2,0.05,0.02,0.6,0.12,3,2,0.5,20,WIDE_V2,0.5,,,,,,PRUNED
675,-9999.0,2026-05-14 12:04:17.322908,2026-05-14 12:04:17.673541,0 days 00:00:00.350633,0,CAP_LAYER,0.45,SAME,0.7,2,0.05,0.02,0.6,0.08,5,2,0.7,5,WIDE_V2,0.5,,,,,BEAR_RATIO < NEUTRAL_RATIO < BULL_RATIO 约束违反: 0.45 / 0.7 / 0.7,COMPLETE
676,0.22786268341686633,2026-05-14 12:04:17.697998,2026-05-14 12:05:31.510933,0 days 00:01:13.812935,0,CAP_LAYER,0.45,SAME,0.9,2,0.03,0.02,0.6,0.08,3,2,0.5,5,WIDE_V2,0.5,,,,,,PRUNED
677,-0.3866701145655381,2026-05-14 12:05:31.534900,2026-05-14 12:07:45.626289,0 days 00:02:14.091389,0,CAP_LAYER,0.35,SAME,0.7,2,0.05,0.02,0.6,0.08,4,2,0.5,5,WIDE_V2,0.5,-0.04739501113097501,0.13007388785544294,0.6785502068691263,0.17746889898641793,,COMPLETE
678,-0.4522941293345024,2026-05-14 12:07:45.648950,2026-05-14 12:10:07.560843,0 days 00:02:21.911893,0,CAP_LAYER,0.45,SAME,0.7,3,0.05,0.02,0.6,0.08,5,2,0.5,5,WIDE_V2,0.5,-0.08841103946568984,0.05579212378147914,0.7277661797376251,0.14420316324716898,,COMPLETE
679,0.0659194981313123,2026-05-14 12:10:07.587134,2026-05-14 12:11:05.086096,0 days 00:00:57.498962,0,CAP_LAYER,0.45,ETF_DEFENSIVE,0.7,2,0.05,0.02,0.6,0.08,3,1,0.5,5,WIDE_V2,0.5,,,,,,PRUNED
680,0.15613581663057086,2026-05-14 12:11:05.105557,2026-05-14 12:12:24.130228,0 days 00:01:19.024671,0,CAP_LAYER,0.45,SAME,0.7,4,0.05,0.02,0.6,0.08,3,2,0.5,5,WIDE_V2,0.8,,,,,,PRUNED
681,0.2480339546150649,2026-05-14 12:12:24.152774,2026-05-14 12:13:38.548783,0 days 00:01:14.396009,0,CAP_LAYER,0.45,SAME,0.7,4,0.05,0.02,0.6,0.08,3,1,0.5,5,WIDE_V2,0.5,,,,,,PRUNED
682,0.1173426148297246,2026-05-14 12:13:38.573950,2026-05-14 12:15:17.632528,0 days 00:01:39.058578,0,CAP_LAYER,0.45,SAME,0.7,2,0.05,0.02,0.6,0.16,10,2,0.5,5,WIDE_V2,0.5,,,,,,PRUNED
683,-0.5264797760064815,2026-05-14 12:15:17.656198,2026-05-14 12:19:22.562884,0 days 00:04:04.906686,1,CAP_LAYER,0.45,SAME,0.7,2,0.05,0.02,0.6,0.08,6,2,0.5,5,WIDE_V2,0.5,-0.12797316406869552,0.06487530842151416,0.797013223875572,0.1928484724902097,,COMPLETE
684,0.1866011105781854,2026-05-14 12:19:22.586226,2026-05-14 12:20:35.297395,0 days 00:01:12.711169,0,NORMAL,0.45,SAME,0.7,2,0.05,0.02,0.6,0.08,3,2,0.5,5,WIDE_V2,0.8,,,,,,PRUNED
685,-0.37484301076910703,2026-05-14 12:20:35.325219,2026-05-14 12:22:57.276746,0 days 00:02:21.951527,0,CAP_LAYER,0.45,SAME,0.7,2,0.03,0.02,0.6,0.08,4,2,0.5,5,WIDE_V2,0.5,-0.02717138606122755,0.14670585028766497,0.695343249415759,0.17387723634889252,,COMPLETE
686,0.20946434143472803,2026-05-14 12:22:57.302965,2026-05-14 12:24:15.625702,0 days 00:01:18.322737,0,NO_NET_ADD,0.45,SAME,0.7,2,0.05,0.02,0.6,0.08,3,2,0.6,5,WIDE_V2,0.5,,,,,,PRUNED
687,-0.519945370934862,2026-05-14 12:24:15.651639,2026-05-14 12:26:37.633952,0 days 00:02:21.982313,0,CAP_LAYER,0.45,SAME,0.7,4,0.05,0.02,0.6,0.08,6,2,0.5,5,WIDE_V2,0.5,-0.1238604714468134,0.04866332801270027,0.7921697989760973,0.17252379945951368,,COMPLETE
688,-0.3574296867331643,2026-05-14 12:26:37.659125,2026-05-14 12:26:49.175762,0 days 00:00:11.516637,0,CAP_LAYER,0.45,SAME,0.7,2,0.05,0.02,0.6,0.08,3,2,0.5,5,ANCHOR_SATELLITE,0.65,,,,,,PRUNED
689,-0.39910831232511107,2026-05-14 12:26:49.199053,2026-05-14 12:28:04.948784,0 days 00:01:15.749731,0,CAP_LAYER,0.45,SAME,0.7,2,0.05,0.02,0.6,0.08,4,2,0.5,10,WIDE_V2,0.5,-0.06540211646897555,0.17240859047682064,0.6674123917122711,0.2378107069457962,,COMPLETE
690,0.243571435401933,2026-05-14 12:28:04.975303,2026-05-14 12:29:26.073400,0 days 00:01:21.098097,0,CAP_LAYER,0.45,SAME,0.8,2,0.05,0.02,0.6,0.08,3,1,0.5,5,WIDE_V2,0.5,,,,,,PRUNED
